NAME,URL
VERMONT YOUTH SOCCER ASSOCIATION,https://s3.amazonaws.com/irs-form-990/201123539349300407_public.xml
VERMONT BETA CHAPTER OF PI BETA PHI,https://s3.amazonaws.com/irs-form-990/201131259349300018_public.xml
VERMONT CHILDRENS TRUST FOUNDATION,https://s3.amazonaws.com/irs-form-990/201322819349100507_public.xml
VERMONT AUTOMOBILE INSURANCE PLAN,https://s3.amazonaws.com/irs-form-990/201302269349200010_public.xml
VERMONT PLUMBERS AND PIPEFITTERS LABOR MANAGEMENT FUND,https://s3.amazonaws.com/irs-form-990/201312239349200301_public.xml
VERMONT MAPLE FESTIVAL INC,https://s3.amazonaws.com/irs-form-990/201322279349201672_public.xml
VERMONT ASSOCIATION FOR THE BLIND AND VISUALLY IMPAIRED,https://s3.amazonaws.com/irs-form-990/201342349349100704_public.xml
VERMONT RIVER CONSERVANCY INC,https://s3.amazonaws.com/irs-form-990/201342559349300434_public.xml
MASONIC CHARITIES OF VERMONT INC,https://s3.amazonaws.com/irs-form-990/201312219349200801_public.xml
VERMONT CHAPTER ACP ASIM,https://s3.amazonaws.com/irs-form-990/201322259349201597_public.xml
CENTRAL VERMONT COUNCIL ON AGING INC,https://s3.amazonaws.com/irs-form-990/201322259349201597_public.xml
VERMONT HISTORICAL SOCIETY,https://s3.amazonaws.com/irs-form-990/201322259349201597_public.xml
CENTRAL VERMONT CATHOLIC SCHOOL FOUNDATION INC,https://s3.amazonaws.com/irs-form-990/201322259349201597_public.xml
NATIONAL ASSOCIATION OF SOCIAL WORKERS VERMONT CHAPTER,https://s3.amazonaws.com/irs-form-990/201322259349201597_public.xml
OUR HOUSE OF CENTRAL VERMONT INC,https://s3.amazonaws.com/irs-form-990/201322259349201597_public.xml
VERMONT ASSOCIATION OF HOSPITALS AND HEALTH SYSTEMS,https://s3.amazonaws.com/irs-form-990/201322259349201597_public.xml
VERMONT ASSOCIATION OF HOSPITALS AND HEALTH SYSTEMS NETWORK SERVICE ORG,https://s3.amazonaws.com/irs-form-990/201322259349201597_public.xml
VERMONT POLICE ASSOCIATION,https://s3.amazonaws.com/irs-form-990/201322259349201597_public.xml
VERMONT ASSOC OF BUSINESS AND INDUSTRY FOR REHAB,https://s3.amazonaws.com/irs-form-990/201322259349201597_public.xml
VERMONT FEDERATION OF FAMILIES FOR CHILDRENS MENTAL,https://s3.amazonaws.com/irs-form-990/201322259349201597_public.xml
VERMONT FOODBANK,https://s3.amazonaws.com/irs-form-990/201322259349201597_public.xml
EARTHWALK VERMONT INC,https://s3.amazonaws.com/irs-form-990/201322259349201597_public.xml
VERMONT ASSISTANCE INC,https://s3.amazonaws.com/irs-form-990/201322259349201597_public.xml
VERMONT RETAIL LUMBER DEALERS ASSOC INC,https://s3.amazonaws.com/irs-form-990/201322259349201597_public.xml
VERMONT STATE COLLEGE FACULTY FEDERATION AFT LOCAL 3180,https://s3.amazonaws.com/irs-form-990/201322259349201597_public.xml
SOUTHEAST VERMONT COMMUNITY LEARNING COLLABORATIVE,https://s3.amazonaws.com/irs-form-990/201322259349201597_public.xml
PARENT TO PARENT OF VERMONT,https://s3.amazonaws.com/irs-form-990/201322259349201597_public.xml
RUN VERMONT INC,https://s3.amazonaws.com/irs-form-990/201322259349201597_public.xml
VERMONT COMMUNITY ACTION PARTNERSHIP ASSOCIATION,https://s3.amazonaws.com/irs-form-990/201322259349201597_public.xml
VERMONT PARENT INFORMATION CENTER INC,https://s3.amazonaws.com/irs-form-990/201322259349201597_public.xml
VOICES FOR VERMONTS CHILDREN,https://s3.amazonaws.com/irs-form-990/201200619349300905_public.xml
VOICES FOR VERMONTS CHILDREN,https://s3.amazonaws.com/irs-form-990/201230619349300078_public.xml
VERMONT ETHICS NETWORK INC,https://s3.amazonaws.com/irs-form-990/201240659349301119_public.xml
ROTARY CLUB OF ST ALBANS VERMONT INC,https://s3.amazonaws.com/irs-form-990/201240659349301119_public.xml
VERMONT RURAL EDUCATION COLLABORATIVE INC,https://s3.amazonaws.com/irs-form-990/201240659349301119_public.xml
VERMONT ALCOHOL AND DRUG ABUSE CERTIFICATION BOARD INC,https://s3.amazonaws.com/irs-form-990/201240659349301119_public.xml
DISMAS OF VERMONT INC,https://s3.amazonaws.com/irs-form-990/201220619349301452_public.xml
AMERICAN LEGION DEPARTMENT OF VERMONT,https://s3.amazonaws.com/irs-form-990/201210619349300231_public.xml
VERMONT PUBLIC TRANSPORTATION ASSOCIATION INC,https://s3.amazonaws.com/irs-form-990/201220619349300797_public.xml
VERMONT PSYCHIATRIC SURVIVORS INC,https://s3.amazonaws.com/irs-form-990/201220619349300432_public.xml
VERMONT CHIROPRACTIC ASSOCIATION,https://s3.amazonaws.com/irs-form-990/201230619349301533_public.xml
VERMONT CRAFTS COUNCIL,https://s3.amazonaws.com/irs-form-990/201230619349301533_public.xml
VERMONT AFRICAN AMERICAN HISTORY PROJECT INC,https://s3.amazonaws.com/irs-form-990/201220619349302872_public.xml
VERMONT MUSEUM AND GALLERY ALLIANCE,https://s3.amazonaws.com/irs-form-990/201210619349301851_public.xml
FAMILIES FIRST IN SOUTHERN VERMONT INC,https://s3.amazonaws.com/irs-form-990/201240749349300529_public.xml
ROTARY CLUB CHARITIES OF ESSEX VERMONT INC,https://s3.amazonaws.com/irs-form-990/201200659349200130_public.xml
CENTRAL VERMONT DRESSAGE ASSOCIATION INC,https://s3.amazonaws.com/irs-form-990/201230629349200023_public.xml
NCR OF PITTSFORD VERMONT,https://s3.amazonaws.com/irs-form-990/201200729349301000_public.xml
ROTARY CLUB OF ESSEX VERMONT INC AMY JACKMAN,https://s3.amazonaws.com/irs-form-990/201240659349200029_public.xml
VERMONT JAZZ CENTER INC,https://s3.amazonaws.com/irs-form-990/201220619349200627_public.xml
VERMONT PHARMACISTS ASSOCIATION,https://s3.amazonaws.com/irs-form-990/201220659349200132_public.xml
VERMONT ATTRACTIONS ASSOCIATION INC,https://s3.amazonaws.com/irs-form-990/201240659349200344_public.xml
VERMONT SLAUSON ECONOMIC DEVELOPMENT CORPORATION,https://s3.amazonaws.com/irs-form-990/201240679349100704_public.xml
VERMONT ACADEMY,https://s3.amazonaws.com/irs-form-990/201220699349300737_public.xml
VERMONT MORTGAGE BANKERS ASSOCIATION,https://s3.amazonaws.com/irs-form-990/201220619349300242_public.xml
SIGMA PHI OF VERMONT EDUCATIONAL FOUNDATION INC,https://s3.amazonaws.com/irs-form-990/201200639349200320_public.xml
VERMONT MOTOCROSS ASSOCIATION,https://s3.amazonaws.com/irs-form-990/201200639349200320_public.xml
NCR OF RUTLAND VERMONT,https://s3.amazonaws.com/irs-form-990/201230729349300528_public.xml
VERMONT ALCOHOL AND DRUG ABUSE CERTIFICATION BOARD INC,https://s3.amazonaws.com/irs-form-990/201200639349200400_public.xml
VERMONT SLAUSON HOUSING CORPORATION,https://s3.amazonaws.com/irs-form-990/201240689349200759_public.xml
VERMONT SLAUSON LDC INC,https://s3.amazonaws.com/irs-form-990/201240689349200759_public.xml
VERMONT RECREATION AND PARK ASSOCIATION,https://s3.amazonaws.com/irs-form-990/201240689349200759_public.xml
VERMONT CENTER FOR RURAL WOMEN INC,https://s3.amazonaws.com/irs-form-990/201240829349300809_public.xml
VERMONT ACTORS REPERTORY THEATRE COMPANY,https://s3.amazonaws.com/irs-form-990/201200829349200300_public.xml
UD H BINGHAM JR SW VERMONT HLTH,https://s3.amazonaws.com/irs-form-990/201200819349200310_public.xml
VERMONT HIGHER EDUCATION COUNCIL,https://s3.amazonaws.com/irs-form-990/201200809349100200_public.xml
VERMONT LAND TRUST INC,https://s3.amazonaws.com/irs-form-990/201210829349300531_public.xml
VERMONT HUNTER JUMPER ASSOCIATION INC,https://s3.amazonaws.com/irs-form-990/201210769349200011_public.xml
VERMONT HUNTER JUMPER ASSOCIATION INC,https://s3.amazonaws.com/irs-form-990/201210769349200011_public.xml
VERMONT ADULT LEARNING,https://s3.amazonaws.com/irs-form-990/201220819349200717_public.xml
SIGMA ALPHA EPSILON FRATERNITY INC VERMONT BETA CHAPTER,https://s3.amazonaws.com/irs-form-990/201240749349200744_public.xml
VERMONT COUNCIL ON WORLD AFFAIRS INC,https://s3.amazonaws.com/irs-form-990/201240749349200744_public.xml
SAE VERMONT BETA SCHOLARSHIPS INC,https://s3.amazonaws.com/irs-form-990/201240749349100404_public.xml
CAMP AGAPE VERMONT INC,https://s3.amazonaws.com/irs-form-990/201210739349200411_public.xml
VERMONT CENTER FOR INDEPENDENT LIVING,https://s3.amazonaws.com/irs-form-990/201220799349300537_public.xml
VERMONT PARENT INFORMATION CENTER INC,https://s3.amazonaws.com/irs-form-990/201240829349200504_public.xml
VERMONT HUNTER JUMPER ASSOCIATION INC,https://s3.amazonaws.com/irs-form-990/201240829349200504_public.xml
VERMONT ASSOCIATION OF CHIEFS OF POLICE,https://s3.amazonaws.com/irs-form-990/201240829349200504_public.xml
VERMONT VETERINARY MEDICAL ASSOCIATION,https://s3.amazonaws.com/irs-form-990/201240829349200504_public.xml
CENTRAL VERMONT CHAMBER OF COMMERCE INC,https://s3.amazonaws.com/irs-form-990/201240829349200504_public.xml
VERMONT YANKEE NUCLEAR POWER CORPORATION EMPLOYEE BENEFITS TRUST,https://s3.amazonaws.com/irs-form-990/201240829349200504_public.xml
DISABILITY RIGHTS VERMONT INC,https://s3.amazonaws.com/irs-form-990/201240829349200504_public.xml
SOUTHERN VERMONT RECREATION CENTER,https://s3.amazonaws.com/irs-form-990/201240829349200504_public.xml
VERMONT - NEA,https://s3.amazonaws.com/irs-form-990/201240829349200504_public.xml
ALPHA OF VERMONT CHAPTER OF SIGMA PHI SOCIETY,https://s3.amazonaws.com/irs-form-990/201240829349200504_public.xml
VERMONTS CAMP TA-KUM-TA,https://s3.amazonaws.com/irs-form-990/201240829349200504_public.xml
VERMONT FREEDOM TO MARRY TASK FORCE,https://s3.amazonaws.com/irs-form-990/201240829349200504_public.xml
VERMONT HUNTER JUMPER ASSOCIATION INC,https://s3.amazonaws.com/irs-form-990/201240829349200504_public.xml
VERMONT HUNTER JUMPER ASSOCIATION INC,https://s3.amazonaws.com/irs-form-990/201240829349200504_public.xml
VERMONT FAMILY NETWORK INC,https://s3.amazonaws.com/irs-form-990/201240829349200504_public.xml
HOME BUILDERS ASSOCIATION OF CENTRAL VERMONT,https://s3.amazonaws.com/irs-form-990/201241009349300704_public.xml
VERMONT GOLF COURSE SUPERINTENDENTS ASSOCIATION INC,https://s3.amazonaws.com/irs-form-990/201240899349300209_public.xml
VERMONT BUSINESS EDUCATION,https://s3.amazonaws.com/irs-form-990/201240879349300429_public.xml
VERMONT FUNERAL DIRECTORS AND EMBALMERS ASSOCIATION,https://s3.amazonaws.com/irs-form-990/201201019349200720_public.xml
VERMONT PUBLIC RADIO,https://s3.amazonaws.com/irs-form-990/201220969349300507_public.xml
VERMONT SOCIETY OF LAND SURVEYORS INC,https://s3.amazonaws.com/irs-form-990/201241149349200024_public.xml
MAJIC VERMONT FOUNDATION,https://s3.amazonaws.com/irs-form-990/201201049349100125_public.xml
VERMONT LIONS CHARITIES INC,https://s3.amazonaws.com/irs-form-990/201201049349100125_public.xml
VERMONT INFORMATION TECHNOLOGY LEAD,https://s3.amazonaws.com/irs-form-990/201220869349300702_public.xml
GILL ODD FELLOWS HOME OF VERMONT,https://s3.amazonaws.com/irs-form-990/201230909349300518_public.xml
SHRM VERMONT STATE COUNCIL INC,https://s3.amazonaws.com/irs-form-990/201200839349200510_public.xml
VERMONT INSTITUTE OF NATURAL SCIENCE INC,https://s3.amazonaws.com/irs-form-990/201200909349200855_public.xml
VERMONT CHRISTIAN EDUCATION FOUNDATION LTD,https://s3.amazonaws.com/irs-form-990/201241009349200609_public.xml
COUNCIL ON AGING FOR SOUTHEASTERN VERMONT INC,https://s3.amazonaws.com/irs-form-990/201220889349100502_public.xml
FRIENDS OF THE VERMONT VETERANS HOME INC,https://s3.amazonaws.com/irs-form-990/201211089349300406_public.xml
VERMONT INTERFAITH ACTION INC,https://s3.amazonaws.com/irs-form-990/201200909349200410_public.xml
VERMONT NORTH BY HAND ARTISANS COOPERATIVE,https://s3.amazonaws.com/irs-form-990/201241079349300404_public.xml
SOCIETY OF VERMONT ARTISTS AND CRAFTSMEN INC,https://s3.amazonaws.com/irs-form-990/201241019349100009_public.xml
VERMONT MEDICAL SOCIETY,https://s3.amazonaws.com/irs-form-990/201241019349100009_public.xml
VERMONT FARMS ASSOCIATION,https://s3.amazonaws.com/irs-form-990/201220899349200527_public.xml
VERMONT ETV INC DBA VERMONT PUBLIC TELEVISION,https://s3.amazonaws.com/irs-form-990/201231309349300238_public.xml
VERMONT EMPLOYEE OWNERSHIP CENTER INC,https://s3.amazonaws.com/irs-form-990/201221309349301737_public.xml
TRI-STATE CHAPTER 843 VERMONT,https://s3.amazonaws.com/irs-form-990/201241299349301109_public.xml
VERMONT INN AND BED AND BREAKFAST ASSOCIATION,https://s3.amazonaws.com/irs-form-990/201241319349302834_public.xml
VERMONT GOLF ASSOCIATION,https://s3.amazonaws.com/irs-form-990/201201309349302300_public.xml
VERMONT TRADITIONS COALITION,https://s3.amazonaws.com/irs-form-990/201201309349302300_public.xml
VERMONT STATE GRANGE INC,https://s3.amazonaws.com/irs-form-990/201221309349300857_public.xml
VERMONT PROGRAM FOR QUALITY IN HEALTH CARE INC,https://s3.amazonaws.com/irs-form-990/201231319349300113_public.xml
ROTARY CLUB OF MIDDLEBURY VERMONT INC,https://s3.amazonaws.com/irs-form-990/201221289349200442_public.xml
UNITED PROFESSIONS OF VERMONT AFT LOCAL 8043,https://s3.amazonaws.com/irs-form-990/201211259349200106_public.xml
VERMONT MOUNTAIN BIKE ADVOCATES DBA VERMONT MOUNTAIN BIKE ASSOCIATION,https://s3.amazonaws.com/irs-form-990/201231289349301418_public.xml
VERMONT MOUNTAIN BIKE ADVOCATES DBA VERMONT MOUNTAIN BIKE ASSOCIATION,https://s3.amazonaws.com/irs-form-990/201231289349301418_public.xml
VERMONT ELECTRIC COOPERATIVE INC,https://s3.amazonaws.com/irs-form-990/201211309349200806_public.xml
HILLEL AT THE UNIVERSITY OF VERMONT,https://s3.amazonaws.com/irs-form-990/201221229349300202_public.xml
VERMONT PWA COALITION,https://s3.amazonaws.com/irs-form-990/201221229349300202_public.xml
VERMONT CAMPAIGN FOR HEALTH CARE,https://s3.amazonaws.com/irs-form-990/201201289349200600_public.xml
VERMONT ELECTRICAL CONTRACTORS ASSOCIATION INC,https://s3.amazonaws.com/irs-form-990/201211329349301636_public.xml
VERMONT ASSOCIATION CONSERVATION DISTRICTS INC,https://s3.amazonaws.com/irs-form-990/201211329349302776_public.xml
VERMONT GREEN BUILDING NETWORK INC,https://s3.amazonaws.com/irs-form-990/201211329349302776_public.xml
VERMONT CHILDRENS TRUST FOUNDATION,https://s3.amazonaws.com/irs-form-990/201201369349307745_public.xml
VERMONT PSYCHOLOGICAL ASSOCIATION INC,https://s3.amazonaws.com/irs-form-990/201241189349200614_public.xml
VERMONT TRAVEL INDUSTRY CONFERENCE,https://s3.amazonaws.com/irs-form-990/201241219349100779_public.xml
VERMONT CHILDRENS AID SOCIETY INC,https://s3.amazonaws.com/irs-form-990/201241079349200029_public.xml
VERMONT KIN AS PARENTS INC,https://s3.amazonaws.com/irs-form-990/201241319349101189_public.xml
VERMONT ENERGY PARTNERSHIP INC,https://s3.amazonaws.com/irs-form-990/201241319349101189_public.xml
VERMONT SPECIALTY FOOD ASSOCIATION,https://s3.amazonaws.com/irs-form-990/201221239349300337_public.xml
CENTRAL VERMONT SUBSTANCE ABUSE SERVICES INC,https://s3.amazonaws.com/irs-form-990/201211109349100411_public.xml
VERMONT STATE NURSES ASSOCIATION INC,https://s3.amazonaws.com/irs-form-990/201211109349100411_public.xml
BEHAVIORAL HEALTH NETWORK OF VERMONT INC,https://s3.amazonaws.com/irs-form-990/201211539349300321_public.xml
VERMONT OUTDOOR GUIDES ASSOCIATION,https://s3.amazonaws.com/irs-form-990/201201359349306350_public.xml
PARENT TO PARENT OF VERMONT,https://s3.amazonaws.com/irs-form-990/201231369349307063_public.xml
CROSS VERMONT TRAIL ASSOCIATION INC,https://s3.amazonaws.com/irs-form-990/201221589349200417_public.xml
VERMONT CARIBBEAN INSTITUTE INC,https://s3.amazonaws.com/irs-form-990/201221589349200417_public.xml
VERMONT REFUGEE ASSISTANCE INC,https://s3.amazonaws.com/irs-form-990/201211329349302576_public.xml
VERMONT BALLET THEATER INC,https://s3.amazonaws.com/irs-form-990/201201369349203250_public.xml
CATHOLIC FOUNDATION TRUST OF VERMONT,https://s3.amazonaws.com/irs-form-990/201211359349200706_public.xml
ASSOCIATION OF NOTRE DAME CLUBS INC VERMONT,https://s3.amazonaws.com/irs-form-990/201201369349302310_public.xml
VERMONT HILLS FAMILY LIFE CENTER,https://s3.amazonaws.com/irs-form-990/201201359349302735_public.xml
PHYSICIAN ASSISTANT ACADEMY OF VERMONT,https://s3.amazonaws.com/irs-form-990/201221359349302512_public.xml
GUARDIANSHIP TRUST OF VERMONT INC,https://s3.amazonaws.com/irs-form-990/201211359349202386_public.xml
NORTHEAST ORGANIC FARMING ASSOCIATION OF VERMONT IN,https://s3.amazonaws.com/irs-form-990/201241379349300719_public.xml
VERMONT LAW SCHOOL,https://s3.amazonaws.com/irs-form-990/201211369349304666_public.xml
NORTHEAST KINGDOM COUNCIL OF AGING INC DBA AREA AGENCY ON AGING FOR NORTHEASTERN VERMONT,https://s3.amazonaws.com/irs-form-990/201221359349304727_public.xml
VERMONT PROPERTY AND CASUALTY INSURANCE GUARANTY ASSOCIATION,https://s3.amazonaws.com/irs-form-990/201221359349304727_public.xml
EVERYBODY WINS VERMONT INC,https://s3.amazonaws.com/irs-form-990/201241369349301814_public.xml
SOUTHERN VERMONT COLLEGE,https://s3.amazonaws.com/irs-form-990/201241369349303779_public.xml
VERMONT YOUTH ORCHESTRA ASSOCIATION INC,https://s3.amazonaws.com/irs-form-990/201201369349303135_public.xml
VERMONT MORGAN HORSE ASSOCIATION IN,https://s3.amazonaws.com/irs-form-990/201231589349200158_public.xml
VERMONT CHAMBER OF COMMERCE,https://s3.amazonaws.com/irs-form-990/201241329349301154_public.xml
FRIENDS OF THE VERMONT STATEHOUSE,https://s3.amazonaws.com/irs-form-990/201211359349202891_public.xml
VERMONT DENTAL CARE PROGRAMS INC,https://s3.amazonaws.com/irs-form-990/201231359349302213_public.xml
VERMONT FARM BUREAU INC,https://s3.amazonaws.com/irs-form-990/201201369349304960_public.xml
VERMONT STAGE COMPANY,https://s3.amazonaws.com/irs-form-990/201231369349305013_public.xml
VERMONT RECOVERY NETWORK INC,https://s3.amazonaws.com/irs-form-990/201231329349301798_public.xml
NORTHWESTERN VERMONT VIETNAM VETERANS OF AMERICAN CHAPTER 753 STATE COUNCIL OF VT,https://s3.amazonaws.com/irs-form-990/201201649349300805_public.xml
CENTRAL VERMONT COMMUNITY TELEVISION,https://s3.amazonaws.com/irs-form-990/201241809349300734_public.xml
VERMONT AYRSHIRE CLUB INC,https://s3.amazonaws.com/irs-form-990/201241809349300734_public.xml
VERMONT FAMILY FORESTS FOUNDATION,https://s3.amazonaws.com/irs-form-990/201241709349200114_public.xml
VERMONT BAR FOUNDATION,https://s3.amazonaws.com/irs-form-990/201201809349300865_public.xml
VERMONT CONSORTIUM OF ACADEMIC LIBRARIES INC,https://s3.amazonaws.com/irs-form-990/201242069349300314_public.xml
VERMONT CFIDS ASSOCIATION INC,https://s3.amazonaws.com/irs-form-990/201242069349300314_public.xml
EASTER SEALS VERMONT INC,https://s3.amazonaws.com/irs-form-990/201211959349300641_public.xml
CATHOLIC FOUNDATION TRUST OF VERMONT,https://s3.amazonaws.com/irs-form-990/201232019349200418_public.xml
CATHOLIC FOUNDATION TRUST OF VERMONT,https://s3.amazonaws.com/irs-form-990/201232019349200418_public.xml
SOUTHWESTERN VERMONT MEDICAL CENTER,https://s3.amazonaws.com/irs-form-990/201222219349301152_public.xml
VERMONT STATE FIREFIGHTERS ASSOCIATION,https://s3.amazonaws.com/irs-form-990/201222209349301172_public.xml
MAKE A WISH FOUNDATION OF VERMONT,https://s3.amazonaws.com/irs-form-990/201231989349300603_public.xml
VERMONT NETWORK AGAINST DOMESTIC VIOLENCE AND SEXUAL ASSAULT INC,https://s3.amazonaws.com/irs-form-990/201241959349300734_public.xml
CENTRAL VERMONT RUNNERS,https://s3.amazonaws.com/irs-form-990/201241959349300964_public.xml
VERMONT HUMANITIES COUNCIL,https://s3.amazonaws.com/irs-form-990/201241959349300964_public.xml
VERMONT COMMITTEE OF THE NATIONAL MUSEUM OF WOMEN IN THE ARTS,https://s3.amazonaws.com/irs-form-990/201201939349300125_public.xml
COMMUNITY OF VERMONT ELDERS INC,https://s3.amazonaws.com/irs-form-990/201222019349300522_public.xml
PATIENT CHOICES AT END OF LIFE VERMONT INC,https://s3.amazonaws.com/irs-form-990/201222019349300522_public.xml
VERMONT BAR ASSOCIATION,https://s3.amazonaws.com/irs-form-990/201241939349300114_public.xml
VERMONT INDEPENDENT SCHOOL OF THE ARTS INC,https://s3.amazonaws.com/irs-form-990/201221989349200012_public.xml
SOUTHWESTERN VERMONT HEALTH CARE CORPORATION,https://s3.amazonaws.com/irs-form-990/201232219349301153_public.xml
VERMONT CHILDRENS ALLIANCE,https://s3.amazonaws.com/irs-form-990/201232219349301153_public.xml
VERMONT DEMOCRACY FUND INC,https://s3.amazonaws.com/irs-form-990/201242219349301419_public.xml
VERMONT INSTITUTE OF CONTEMPORARY ARTS,https://s3.amazonaws.com/irs-form-990/201220939349300117_public.xml
VERMONT EASTERN STAR HOME INC,https://s3.amazonaws.com/irs-form-990/201220939349300117_public.xml
VERMONT LEGAL AID INC,https://s3.amazonaws.com/irs-form-990/201202219349300735_public.xml
SOUTHERN VERMONT BOARD OF REALTORS INC,https://s3.amazonaws.com/irs-form-990/201241929349100754_public.xml
VERMONT ACHIEVEMENT CENTER INC,https://s3.amazonaws.com/irs-form-990/201242069349300104_public.xml
VERMONT ACHIEVEMENT CENTER INC,https://s3.amazonaws.com/irs-form-990/201202069349300700_public.xml
VERMONT ACTIVE CHAPTER OF THE SIGMA PHI SOCIETY,https://s3.amazonaws.com/irs-form-990/201242289349301034_public.xml
VERMONT CREATIVITY QUEST INC,https://s3.amazonaws.com/irs-form-990/201212339349300121_public.xml
SHARE SOUTHERN VERMONT INC,https://s3.amazonaws.com/irs-form-990/201222279349302012_public.xml
VERMONT SYMPHONY ORCHESTRA ASSOCIATION INC,https://s3.amazonaws.com/irs-form-990/201200889349300810_public.xml
HOME BUILDERS AND REMODELERS ASSOCIATION OF NORTHERN VERMONT INC,https://s3.amazonaws.com/irs-form-990/201212229349301236_public.xml
NORTHERN VERMONT RESOURCE CONSERVATION AND DEVELOPMENT COUNCIL,https://s3.amazonaws.com/irs-form-990/201202269349201020_public.xml
GOVERNORS INSTITUTES OF VERMONT,https://s3.amazonaws.com/irs-form-990/201202239349301015_public.xml
VERMONT STATE EMPLOYEES ASSOC INC,https://s3.amazonaws.com/irs-form-990/201232289349300548_public.xml
VERMONTS NORTH COUNTRY CHAMBER OF COMMERCE,https://s3.amazonaws.com/irs-form-990/201222289349201417_public.xml
BPOE VERMONT ELKS ASSOCIATION INC,https://s3.amazonaws.com/irs-form-990/201200899349300005_public.xml
PRESERVATION TRUST OF VERMONT INC,https://s3.amazonaws.com/irs-form-990/201202289349301720_public.xml
VERMONT ASSOCIATION OF WEDDING PROFESSIONALS,https://s3.amazonaws.com/irs-form-990/201212269349301891_public.xml
VERMONT ASSOCIATION OF WEDDING PROFESSIONALS,https://s3.amazonaws.com/irs-form-990/201212269349301891_public.xml
VERMONT ALLIANCE FOR THE SOCIAL STUDIES,https://s3.amazonaws.com/irs-form-990/201211019349300621_public.xml
VERMONT CARES,https://s3.amazonaws.com/irs-form-990/201232239349301168_public.xml
VERMONT BREWERS ASSOCIATION INC,https://s3.amazonaws.com/irs-form-990/201232269349302333_public.xml
VERMONT HEALTH CARE ASSOCIATION,https://s3.amazonaws.com/irs-form-990/201212239349200016_public.xml
RENEWABLE ENERGY VERMONT INC,https://s3.amazonaws.com/irs-form-990/201212239349200016_public.xml
EPILEPSY FOUNDATION OF VERMONT INC,https://s3.amazonaws.com/irs-form-990/201240899349100214_public.xml
VERMONT WORKERS CENTER,https://s3.amazonaws.com/irs-form-990/201222269349302672_public.xml
BROC COMMUNITY ACTION IN SOUTHWESTERN VERMONT,https://s3.amazonaws.com/irs-form-990/201220699349200752_public.xml
VETERANS OF FOREIGN WARS OF THE UNITED STATES DEPT OF VERMONT,https://s3.amazonaws.com/irs-form-990/201220699349200752_public.xml
AMERICAN CIVIL LIBERTIES UNION FOUNDATION OF VERMONT INC,https://s3.amazonaws.com/irs-form-990/201242409349200304_public.xml
VERMONT FRESH NETWORK,https://s3.amazonaws.com/irs-form-990/201232439349100208_public.xml
OUTRIGHT VERMONT,https://s3.amazonaws.com/irs-form-990/201232439349100208_public.xml
VERMONT MEDICAL MANAGERS,https://s3.amazonaws.com/irs-form-990/201242419349300404_public.xml
CENTRAL VERMONT HUMANE SOCIETY INC,https://s3.amazonaws.com/irs-form-990/201220879349300402_public.xml
VERMONT GREEN UP INC,https://s3.amazonaws.com/irs-form-990/201232499349200618_public.xml
BEVERAGE ASSOCIATION OF VERMONT,https://s3.amazonaws.com/irs-form-990/201220699349300547_public.xml
AMERICAN CIVIL LIBERTIES UNION OF VERMONT INC,https://s3.amazonaws.com/irs-form-990/201242509349300719_public.xml
VERMONT COUNCIL ON RURAL DEVELOPMENT INC,https://s3.amazonaws.com/irs-form-990/201230799349300103_public.xml
LEAGUE OF VERMONT WRITERS,https://s3.amazonaws.com/irs-form-990/201240699349300904_public.xml
VERMONT RIGHT TO LIFE COMMITTEE INC,https://s3.amazonaws.com/irs-form-990/201240739349301039_public.xml
VERMONT ORTHOPAEDIC CLINIC INC,https://s3.amazonaws.com/irs-form-990/201240739349301039_public.xml
VERMONT FEDERATION OF SPORTSMENS CLUBS,https://s3.amazonaws.com/irs-form-990/201240759349300449_public.xml
VERMONT SKI MUSEUM INC,https://s3.amazonaws.com/irs-form-990/201242499349200004_public.xml
VERMONT ELKS CHARITIES INC DBA SILVER TOWERS CAMP FOR PEOPLE WITH DISABILITIES,https://s3.amazonaws.com/irs-form-990/201210799349300411_public.xml
FEDERATION OF STATE CONSERVATION LEAGUES VERMONT LEAGUE OF CONSERVATION VOTERS,https://s3.amazonaws.com/irs-form-990/201210799349300411_public.xml
VERMONT LEAGUE OF CONSERVATION VOTERS EDUCATION FUND,https://s3.amazonaws.com/irs-form-990/201210799349300411_public.xml
VERMONT CHILD CARE PROVIDERS ASSOCIATION,https://s3.amazonaws.com/irs-form-990/201240799349300644_public.xml
VERMONT RIGHT TO LIFE COMMITTEE EDUCATIONAL TRUST FUND,https://s3.amazonaws.com/irs-form-990/201240799349300644_public.xml
VERMONT FEDERATION OF NURSES AND HEALTHCARE PROFESSIONALS,https://s3.amazonaws.com/irs-form-990/201241189349300304_public.xml
VERMONT PILOTS ASSOCIATION,https://s3.amazonaws.com/irs-form-990/201220729349200712_public.xml
ASSOCIATION OF AFRICANS LIVING IN VERMONT INC,https://s3.amazonaws.com/irs-form-990/201230979349200613_public.xml
DANVILLE VERMONT HISTORICAL SOCIETY INC,https://s3.amazonaws.com/irs-form-990/201231229349301203_public.xml
CENTRAL VERMONT COMMUNITY LAND TRUST INC,https://s3.amazonaws.com/irs-form-990/201221159349300717_public.xml
CREDIT UNION OF VERMONT,https://s3.amazonaws.com/irs-form-990/201200889349300440_public.xml
THE VERMONT CENTER FOR ECOSTUDIES INC,https://s3.amazonaws.com/irs-form-990/201230879349300738_public.xml
BIRDS OF VERMONT MUSEUM INC,https://s3.amazonaws.com/irs-form-990/201201229349200615_public.xml
VERMONT HAITI PROJECT,https://s3.amazonaws.com/irs-form-990/201201289349201110_public.xml
