NAME,URL
STARBASE VERMONT INCORPORATED,https://s3.amazonaws.com/irs-form-990/201440989349200214_public.xml
COUNCIL ON AGING FOR SOUTHEASTERN VERMONT INC,https://s3.amazonaws.com/irs-form-990/201440999349200204_public.xml
VERMONT DAUCE THEATER,https://s3.amazonaws.com/irs-form-990/201440939349300434_public.xml
VERMONT LEGAL AID INC,https://s3.amazonaws.com/irs-form-990/201421009349300707_public.xml
VERMONT STATE GRANGE PATRONS OF 487 BATTENKILL,https://s3.amazonaws.com/irs-form-990/201401009349300125_public.xml
VERMONT ADULT LEARNING INC,https://s3.amazonaws.com/irs-form-990/201440999349100104_public.xml
CROSS VERMONT TRAIL ASSOCIATION INC,https://s3.amazonaws.com/irs-form-990/201431129349300823_public.xml
CROSS VERMONT TRAIL ASSOCIATION INC,https://s3.amazonaws.com/irs-form-990/201431129349300823_public.xml
VTWIN CRUISERS OF VERMONT,https://s3.amazonaws.com/irs-form-990/201431129349300823_public.xml
PTOC VERMONT ELEMENTARY SCH,https://s3.amazonaws.com/irs-form-990/201431129349300823_public.xml
VERMONT CAMPAIGN FOR HEALTH CARE,https://s3.amazonaws.com/irs-form-990/201431129349300823_public.xml
VERMONT PWA COALITION,https://s3.amazonaws.com/irs-form-990/201431129349300823_public.xml
UD H BINGHAM JR SW VERMONT HLTH,https://s3.amazonaws.com/irs-form-990/201431129349300823_public.xml
VERMONT EMPLOYEE OWNERSHIP CENTER,https://s3.amazonaws.com/irs-form-990/201431129349300823_public.xml
VOICES FOR VERMONTS CHILDREN,https://s3.amazonaws.com/irs-form-990/201431259349301458_public.xml
VERMONT DENTAL FOUNDATION,https://s3.amazonaws.com/irs-form-990/201401269349301490_public.xml
VERMONT HOUSING FINANCE AGENCY,https://s3.amazonaws.com/irs-form-990/201421289349301097_public.xml
VERMONT STATE FIREFIGHTERS ASSOCIATION,https://s3.amazonaws.com/irs-form-990/201441219349301329_public.xml
VERMONT ASSOCIATION FOR MENTAL HEALTH AND ADDICTION RECOVERY INC,https://s3.amazonaws.com/irs-form-990/201441199349300349_public.xml
VERMONT ADULT LEARNING INC,https://s3.amazonaws.com/irs-form-990/201431019349300918_public.xml
SOUTHEASTERN VERMONT ECONOMIC DEVELOPMENT STRATEGIES INC,https://s3.amazonaws.com/irs-form-990/201401029349300415_public.xml
VERMONT LIONS CHARITIES INC,https://s3.amazonaws.com/irs-form-990/201401049349100410_public.xml
VERMONT REFUGEE ASSISTANCE INC,https://s3.amazonaws.com/irs-form-990/201421269349301307_public.xml
SOUTHERN VERMONT BOARD OF REALTORS,https://s3.amazonaws.com/irs-form-990/201401289349301240_public.xml
VERMONT ELECTRIC COOPERATIVE INC,https://s3.amazonaws.com/irs-form-990/201431249349200003_public.xml
BEVERAGE ASSOCIATION OF VERMONT,https://s3.amazonaws.com/irs-form-990/201431289349301798_public.xml
VERMONT ASSOCIATION OF CONSERVATION DISTRICTS INC,https://s3.amazonaws.com/irs-form-990/201431289349301798_public.xml
VERMONT PERMANENCY INITIATIVE INC,https://s3.amazonaws.com/irs-form-990/201431289349301798_public.xml
VERMONT MAPLE SUGAR MAKERS ASSOC INC,https://s3.amazonaws.com/irs-form-990/201411049349301201_public.xml
VERMONT HIGHER EDUCATION COUN,https://s3.amazonaws.com/irs-form-990/201431289349300638_public.xml
CATHOLIC FOUNDATION TRUST OF VERMONT,https://s3.amazonaws.com/irs-form-990/201401219349200645_public.xml
BEHAVIORAL HEALTH NETWORK OF VERMONT INC,https://s3.amazonaws.com/irs-form-990/201431279349301128_public.xml
VERMONT ENERGY EDUCATION PROGRAM INC,https://s3.amazonaws.com/irs-form-990/201441049349201004_public.xml
VERMONT JOURNALISM TRUST,https://s3.amazonaws.com/irs-form-990/201441049349201004_public.xml
VETERANS OF FOREIGN WARS OF THE UNITED STATES DEPT OF VERMONT,https://s3.amazonaws.com/irs-form-990/201431269349201428_public.xml
VERMONT AYRSHIRE CLUB INC,https://s3.amazonaws.com/irs-form-990/201431269349201428_public.xml
VERMONT CLUB CHARITIES INC,https://s3.amazonaws.com/irs-form-990/201441079349200104_public.xml
VERMONT TRAVEL INDUSTRY CONFERENCE,https://s3.amazonaws.com/irs-form-990/201411019349300921_public.xml
VERMONT INSTITUTE OF CONTEMPORARY ARTS,https://s3.amazonaws.com/irs-form-990/201411019349300921_public.xml
VERMONT MAPLE FOUNDATION,https://s3.amazonaws.com/irs-form-990/201431069349300108_public.xml
VERMONT AFRICAN-AMERICAN HISTORY PROJECT INC,https://s3.amazonaws.com/irs-form-990/201431069349300108_public.xml
VERMONT CRAFTS COUNCIL,https://s3.amazonaws.com/irs-form-990/201431059349300503_public.xml
O U R HOUSE OF CENTRAL VERMONT INC,https://s3.amazonaws.com/irs-form-990/201401359349306075_public.xml
VERMONT THEATRE FESTIVAL INC,https://s3.amazonaws.com/irs-form-990/201401359349306075_public.xml
VERMONT ASSOC OF NURSE ANESTHETISTS,https://s3.amazonaws.com/irs-form-990/201411359349200311_public.xml
BUILDING PERFORMANCE PROFESSIONALS ASSOCIATION OF VERMONT INC,https://s3.amazonaws.com/irs-form-990/201411349349306236_public.xml
BPOE VERMONT ELKS ASSOCIATION INC,https://s3.amazonaws.com/irs-form-990/201401339349203175_public.xml
VERMONT ACTIVE CHAPTER OF THE SIGMA PHI SOCIETY,https://s3.amazonaws.com/irs-form-990/201411299349301866_public.xml
VERMONT ARCHAEOLOGICAL SOCIETY INC,https://s3.amazonaws.com/irs-form-990/201411299349301866_public.xml
VERMONT INFORMATION TECHNOLOGY LEAD,https://s3.amazonaws.com/irs-form-990/201421339349303012_public.xml
VERMONT LAW SCHOOL,https://s3.amazonaws.com/irs-form-990/201411359349303441_public.xml
VERMONT GRANITE MUSEUM OF BARRE INC,https://s3.amazonaws.com/irs-form-990/201441299349300334_public.xml
SOUTHERN VERMONT RECREATION CENTER,https://s3.amazonaws.com/irs-form-990/201441299349300334_public.xml
VERMONT BEEF INDUSTRY COUNCIL INC,https://s3.amazonaws.com/irs-form-990/201441309349200404_public.xml
VERMONT ASSOCIATION OF HOSPITALS AND HEALTH SYSTEMS - NETWORK SERVICE ORG,https://s3.amazonaws.com/irs-form-990/201401759349300130_public.xml
VERMONT FARM BUREAU INC,https://s3.amazonaws.com/irs-form-990/201431359349303813_public.xml
VERMONT ASSOCIATION OF HOSPITALS AND HEALTH SYSTEMS,https://s3.amazonaws.com/irs-form-990/201431759349300318_public.xml
HILLEL AT THE UNIVERSITY OF VERMONT,https://s3.amazonaws.com/irs-form-990/201421339349201007_public.xml
SOUTHEASTERN VERMONT COMMUNITY ACTION INC,https://s3.amazonaws.com/irs-form-990/201431339349304913_public.xml
PROFESSIONAL FIREFIGHTERS OF VERMONT,https://s3.amazonaws.com/irs-form-990/201421359349300627_public.xml
VERMONT SOCIETY OF LAND SURVEYORS INC,https://s3.amazonaws.com/irs-form-990/201441359349204174_public.xml
VERMONT NEA,https://s3.amazonaws.com/irs-form-990/201421359349300637_public.xml
VERMONT CHAPTER CONSTRUCTION SPECIFICATIONS INSTITUTE INC,https://s3.amazonaws.com/irs-form-990/201411359349202321_public.xml
VERMONT EASTERN STAR HOME INC,https://s3.amazonaws.com/irs-form-990/201441349349305004_public.xml
VERMONT OUTDOOR GUIDES ASSOCIATION,https://s3.amazonaws.com/irs-form-990/201441699349301009_public.xml
VERMONT STATE GRANGE PATRONS OF 487 BATTENKILL,https://s3.amazonaws.com/irs-form-990/201441919349300344_public.xml
VERMONT STATE GRANGE PATRONS OF 487 BATTENKILL,https://s3.amazonaws.com/irs-form-990/201441919349300344_public.xml
MAKE-A-WISH FOUNDATION OF VERMONT,https://s3.amazonaws.com/irs-form-990/201431959349300973_public.xml
VERMONT STATE GRANGE PATRONS OF 487 BATTENKILL,https://s3.amazonaws.com/irs-form-990/201431959349300973_public.xml
VERMONT STATE GRANGE PATRONS OF 487 BATTENKILL,https://s3.amazonaws.com/irs-form-990/201431959349300973_public.xml
DISABILITY RIGHTS VERMONT INC,https://s3.amazonaws.com/irs-form-990/201431829349300508_public.xml
VERMONT PSYCHIATRIC SURVIVORS INC,https://s3.amazonaws.com/irs-form-990/201401909349300820_public.xml
CENTRAL VERMONT RUNNERS,https://s3.amazonaws.com/irs-form-990/201401909349100205_public.xml
VERMONT BAR ASSOCIATION,https://s3.amazonaws.com/irs-form-990/201441919349300534_public.xml
SOUTHERN VERMONT COLLEGE,https://s3.amazonaws.com/irs-form-990/201411359349304021_public.xml
EASTER SEALS VERMONT INC,https://s3.amazonaws.com/irs-form-990/201411959349300106_public.xml
GUN OWNERS OF VERMONT INC,https://s3.amazonaws.com/irs-form-990/201440529349300904_public.xml
VERMONT CONSORTIUM OF ACADEMIC LIBRARIES INC,https://s3.amazonaws.com/irs-form-990/201420599349300147_public.xml
HOME BUILDERS AND REMODELERS ASSOCIATION OF NORTHERN VERMONT INC,https://s3.amazonaws.com/irs-form-990/201420599349300147_public.xml
SOUTHWESTERN VERMONT HEALTHCARE FOUNDATION INC,https://s3.amazonaws.com/irs-form-990/201440699349300674_public.xml
NATIONAL GUARD ASSOCIATION OF VERMONT,https://s3.amazonaws.com/irs-form-990/201410709349300716_public.xml
VERMONT GREEN UP INC,https://s3.amazonaws.com/irs-form-990/201410709349300716_public.xml
SOCIETY OF VERMONT ARTISTS AND CRAFTSMEN INC,https://s3.amazonaws.com/irs-form-990/201420769349300447_public.xml
CREDIT UNION OF VERMONT,https://s3.amazonaws.com/irs-form-990/201410769349300826_public.xml
VERMONT INSURANCE AGENTS ASSOCIATION INC,https://s3.amazonaws.com/irs-form-990/201440679349300604_public.xml
VERMONT STATE LABOR COUNCIL,https://s3.amazonaws.com/irs-form-990/201440739349301019_public.xml
VERMONTS NORTH COUNTRY CHAMBER OF COMMERCE,https://s3.amazonaws.com/irs-form-990/201400649349300400_public.xml
VERMONT WHOLESALE BEVERAGE ASSOCIATION,https://s3.amazonaws.com/irs-form-990/201400649349300400_public.xml
VERMONT FOUNDATION FOR CHILDREN AND FAMILIES,https://s3.amazonaws.com/irs-form-990/201421359349303152_public.xml
ASSOCIATED GENERAL CONTRACTORS OF VERMONT INC,https://s3.amazonaws.com/irs-form-990/201420579349300112_public.xml
EPILEPSY FOUNDATION OF VERMONT INC,https://s3.amazonaws.com/irs-form-990/201410459349302546_public.xml
LIONS CLUB OF BARRE VERMONT,https://s3.amazonaws.com/irs-form-990/201411289349201551_public.xml
VERMONT HAITI PROJECT,https://s3.amazonaws.com/irs-form-990/201400429349200120_public.xml
VERMONT WRITING COLLABORATIVE INC,https://s3.amazonaws.com/irs-form-990/201401219349200020_public.xml
VERMONT SOFTWARE DEVELOPERS ALLIANCE DBA VERMONT TECHNOLOGY ALLIANCE,https://s3.amazonaws.com/irs-form-990/201430509349200513_public.xml
VERMONT SKI MUSEUM INC,https://s3.amazonaws.com/irs-form-990/201400839349200400_public.xml
SOUTHERN VERMONT STORM INC,https://s3.amazonaws.com/irs-form-990/201430919349200318_public.xml
VERMONT WOOD MANUFACTURERS ASSOCIATION,https://s3.amazonaws.com/irs-form-990/201430919349200318_public.xml
NORTHERN VERMONT RESOURCE CONSERVATION AND DEVELOPMENT COUNCIL,https://s3.amazonaws.com/irs-form-990/201430809349200618_public.xml
VERMONT INTERNATIONAL FILM FOUNDATION,https://s3.amazonaws.com/irs-form-990/201430649349200713_public.xml
VERMONT CENTER FOR ECOSTUDIES INC,https://s3.amazonaws.com/irs-form-990/201420949349300612_public.xml
VERMONT PUBLIC INTEREST RESEARCH AND EDUCATION FUND,https://s3.amazonaws.com/irs-form-990/201402269349303070_public.xml
VERMONTS CAMP TA-KUM-TA,https://s3.amazonaws.com/irs-form-990/201422209349300642_public.xml
VERMONT AVENUE BAPTIST CHURCH DEVELOPMENT CORPORATION,https://s3.amazonaws.com/irs-form-990/201401059349301315_public.xml
PRESERVATION TRUST OF VERMONT INC,https://s3.amazonaws.com/irs-form-990/201402259349300345_public.xml
VERMONT ASSOCIATION OF SNOW TRAVELERS INC,https://s3.amazonaws.com/irs-form-990/201401349349202025_public.xml
VERMONT RIGHT TO LIFE COMMITTEE INC EDUCATIONAL TRUST,https://s3.amazonaws.com/irs-form-990/201412279349202451_public.xml
ENERGIZE VERMONT FOUNDATION INC,https://s3.amazonaws.com/irs-form-990/201412279349202451_public.xml
VERMONT ASSOC OF BUSINESS AND INDUSTRY FOR REHAB,https://s3.amazonaws.com/irs-form-990/201411339349201326_public.xml
BIRDS OF VERMONT MUSEUM INC,https://s3.amazonaws.com/irs-form-990/201401329349201125_public.xml
VERMONT STATE EMPLOYEES ASSOC INC,https://s3.amazonaws.com/irs-form-990/201421269349201297_public.xml
BOSTON MEDICAL CENTER INSURANCE CO LTD OF VERMONT,https://s3.amazonaws.com/irs-form-990/201421049349200702_public.xml
VERMONT INDEPENDENT MEDIA INC,https://s3.amazonaws.com/irs-form-990/201421339349200007_public.xml
VERMONT RETAIL ASSOCIATION INC,https://s3.amazonaws.com/irs-form-990/201411289349201346_public.xml
VERMONT PUBLIC INTEREST RESEARCH GROUP INC,https://s3.amazonaws.com/irs-form-990/201402279349300515_public.xml
UNIVERSITY OF VERMONT FOUNDATION RETIREE HEALTH PLAN,https://s3.amazonaws.com/irs-form-990/201402269349303030_public.xml
VERMONT PROPERTY AND CASUALTY INSURANCE GUARANTY ASSOCIATION,https://s3.amazonaws.com/irs-form-990/201421349349203922_public.xml
VERMONT HOUSING MANAGERS ASSOC INC,https://s3.amazonaws.com/irs-form-990/201401149349200005_public.xml
SOUTHERN VERMONT THERAPEUTIC RIDING CENTER INC,https://s3.amazonaws.com/irs-form-990/201431289349200513_public.xml
PHYSICIAN ASSISTANT ACADEMY OF VERMONT,https://s3.amazonaws.com/irs-form-990/201411329349202561_public.xml
VERMONT ORTHOPAEDIC CLINIC INC,https://s3.amazonaws.com/irs-form-990/201431329349201423_public.xml
VERMONT CHRISTIAN EDUCATION FOUNDATION LTD,https://s3.amazonaws.com/irs-form-990/201431359349204078_public.xml
BEVERLY-VERMONT COMMUNITY LAND TRUST,https://s3.amazonaws.com/irs-form-990/201402259349303510_public.xml
VERMONT HEALTH FOUNDATION INC,https://s3.amazonaws.com/irs-form-990/201412239349301101_public.xml
CENTRAL VERMONT CHAMBER MUSIC FESTIVAL,https://s3.amazonaws.com/irs-form-990/201431329349201013_public.xml
ENERGIZE VERMONT INC,https://s3.amazonaws.com/irs-form-990/201422249349301142_public.xml
AMERICAN CIVIL LIBERTIES UNION OF VERMONT INC,https://s3.amazonaws.com/irs-form-990/201402269349200215_public.xml
VERMONT LITURGICAL AND MUSIC ASSOCIATION INC,https://s3.amazonaws.com/irs-form-990/201441349349202389_public.xml
VERMONT GOLF ASSOCIATION,https://s3.amazonaws.com/irs-form-990/201421069349300517_public.xml
BROC COMMUNITY ACTION IN SOUTHWESTERN VERMONT,https://s3.amazonaws.com/irs-form-990/201411219349200506_public.xml
VERMONT CREATIVITY QUEST INC,https://s3.amazonaws.com/irs-form-990/201401289349302170_public.xml
VERMONT COVERTS WOODLANDS FOR WILDLIFE INC,https://s3.amazonaws.com/irs-form-990/201441269349200249_public.xml
VERMONT CARES,https://s3.amazonaws.com/irs-form-990/201432279349301308_public.xml
VERMONT ANTIQUE AUTOMOBILE SOCIETY INC,https://s3.amazonaws.com/irs-form-990/201402269349201400_public.xml
VERMONT AUTOMOBILE ENTHUSIASTS INC,https://s3.amazonaws.com/irs-form-990/201402269349201085_public.xml
COMPOSTING ASSOCIATION OF VERMONT,https://s3.amazonaws.com/irs-form-990/201431369349200623_public.xml
UNIVERSITY OF VERMONT AND STATE AGRICULTURAL COLLEGE FOUNDATION INC,https://s3.amazonaws.com/irs-form-990/201442279349301544_public.xml
VERMONT FRESH NETWORK CORPORATION,https://s3.amazonaws.com/irs-form-990/201411349349201276_public.xml
FIBER ARTS IN VERMONT INC,https://s3.amazonaws.com/irs-form-990/201402329349300220_public.xml
CENTRAL VERMONT HABITAT FOR HUMANITY INC IONA KEMP TREASURER,https://s3.amazonaws.com/irs-form-990/201422399349300807_public.xml
VERMONTERS FOR HEALTH CARE FREEDOM INC,https://s3.amazonaws.com/irs-form-990/201412269349200876_public.xml
YWCA OF VERMONT INC,https://s3.amazonaws.com/irs-form-990/201421289349201587_public.xml
VERMONT ASSOCIATION OF CHAMBER OF COMMERCE EXECUTIVES,https://s3.amazonaws.com/irs-form-990/201441279349300304_public.xml
VERMONT CAMPGROUND ASSOCIATION INC,https://s3.amazonaws.com/irs-form-990/201421359349201927_public.xml
VERMONT ASSOCIATION OF BROADCASTERS,https://s3.amazonaws.com/irs-form-990/201422349349300202_public.xml
VERMONT CONGREGATIONAL HOME INC,https://s3.amazonaws.com/irs-form-990/201431289349301648_public.xml
VERMONT PSYCHOLOGICAL ASSOCIATION INC,https://s3.amazonaws.com/irs-form-990/201441359349202434_public.xml
PACE VERMONT INC,https://s3.amazonaws.com/irs-form-990/201432279349304143_public.xml
VERMONT ASSOCIATION FOR JUSTICE,https://s3.amazonaws.com/irs-form-990/201431159349300438_public.xml
CENTRAL VERMONT DRESSAGE ASSOCIATION INC,https://s3.amazonaws.com/irs-form-990/201431229349300433_public.xml
O U R HOUSE OF CENTRAL VERMONT INC,https://s3.amazonaws.com/irs-form-990/201421289349202102_public.xml
VERMONT RIGHT TO LIFE COMMITTEE INC,https://s3.amazonaws.com/irs-form-990/201441259349300909_public.xml
VERMONT STATE DENTAL SOCIETY,https://s3.amazonaws.com/irs-form-990/201401349349305800_public.xml
ROTARY CLUB OF MIDDLEBURY VERMONT INC,https://s3.amazonaws.com/irs-form-990/201412389349200501_public.xml
VERMONT CENTER FOR INTEGRATIVE HERBALISM INC,https://s3.amazonaws.com/irs-form-990/201402469349200015_public.xml
CENTRAL VERMONT MEDICAL CENTER INC CREDIT UNION,https://s3.amazonaws.com/irs-form-990/201401349349303275_public.xml
VERMONT TRAPPERS ASSOCIATION INC,https://s3.amazonaws.com/irs-form-990/201432459349300503_public.xml
VERMONT GROCERS ASSOCIATION INC,https://s3.amazonaws.com/irs-form-990/201402419349200415_public.xml
VNA HEALTH SYSTEMS OF VERMONT,https://s3.amazonaws.com/irs-form-990/201442379349200314_public.xml
VERMONT CFIDS ASSOCIATION INC,https://s3.amazonaws.com/irs-form-990/201432339349100103_public.xml
VERMONT RURAL WATER ASSOCIATION,https://s3.amazonaws.com/irs-form-990/201431359349305048_public.xml
VERMONT ENERGY EDUCATION PROGRAM INC,https://s3.amazonaws.com/irs-form-990/201411359349308971_public.xml
MASONIC CHARITIES OF VERMONT INC,https://s3.amazonaws.com/irs-form-990/201402049349200400_public.xml
RONALD MCDONALD HOUSE CHARITIES OF VERMONT INC,https://s3.amazonaws.com/irs-form-990/201421349349302197_public.xml
VERMONT ENERGY PARTNERSHIP INC,https://s3.amazonaws.com/irs-form-990/201401639349200115_public.xml
VERMONT ETHICS NETWORK INC,https://s3.amazonaws.com/irs-form-990/201432549349300138_public.xml
ASSOCIATION OF VERMONT CREDIT UNIONS INC,https://s3.amazonaws.com/irs-form-990/201441349349302129_public.xml
VERMONT AGENCY FOUNDATION LTD,https://s3.amazonaws.com/irs-form-990/201401959349200405_public.xml
LEAGUE OF VERMONT WRITERS,https://s3.amazonaws.com/irs-form-990/201402139349200415_public.xml
VERMONT AUTOMOBILE INSURANCE PLAN,https://s3.amazonaws.com/irs-form-990/201412099349200501_public.xml
RENEWABLE ENERGY VERMONT INC,https://s3.amazonaws.com/irs-form-990/201422539349300022_public.xml
VERMONT SKI AREAS ASSOCIATION,https://s3.amazonaws.com/irs-form-990/201422539349300302_public.xml
VERMONT BAR FOUNDATION,https://s3.amazonaws.com/irs-form-990/201442759349200604_public.xml
VERMONT STATE WOMENS GOLF ASSOCIATION,https://s3.amazonaws.com/irs-form-990/201402229349200450_public.xml
VERMONT HEALTH CARE ASSOCIATION,https://s3.amazonaws.com/irs-form-990/201411649349300526_public.xml
KAPPA SIGMA FRATERNITY UNIVERSITY OF VERMONT - ALPHA LAMBDA,https://s3.amazonaws.com/irs-form-990/201412819349200501_public.xml
VERMONT LOW INCOME TRUST FOR ELECTRICITY INC,https://s3.amazonaws.com/irs-form-990/201411409349300411_public.xml
VERMONT RURAL LETTER CARRIERS ASSOCIATION,https://s3.amazonaws.com/irs-form-990/201432739349200308_public.xml
VERMONT LIONS DISTRICT 45,https://s3.amazonaws.com/irs-form-990/201412759349200311_public.xml
VERMONT QUILT FESTIVAL INC,https://s3.amazonaws.com/irs-form-990/201432249349302218_public.xml
OUTRIGHT VERMONT,https://s3.amazonaws.com/irs-form-990/201442259349301879_public.xml
VERMONT FEDERATION OF NURSES AND HEALTHCARE PROFESSIONALS,https://s3.amazonaws.com/irs-form-990/201432269349202163_public.xml
AMERICAN CIVIL LIBERTIES UNION FOUNDATION OF VERMONT INC,https://s3.amazonaws.com/irs-form-990/201402249349302395_public.xml
VERMONT KIDNEY ASSOCIATION INC,https://s3.amazonaws.com/irs-form-990/201421849349300217_public.xml
DISABLED AMERICAN VETERANS DEPT OF VERMONT,https://s3.amazonaws.com/irs-form-990/201442239349201039_public.xml
VERMONT COUNCIL ON RURAL DEVELOPMENT INC,https://s3.amazonaws.com/irs-form-990/201431759349300708_public.xml
VERMONT FEDERATION OF SPORTSMENS CLUBS,https://s3.amazonaws.com/irs-form-990/201432269349201178_public.xml
VERMONT FLIGHT ACADEMY INC,https://s3.amazonaws.com/irs-form-990/201421969349300022_public.xml
SOUTHERN VERMONT HEALTH SERVICE CORP,https://s3.amazonaws.com/irs-form-990/201402169349300440_public.xml
VERMONT STATE 4-H FOUNDATION,https://s3.amazonaws.com/irs-form-990/201432269349301278_public.xml
VERMONT GOLF ASSOC SCHOLARSHIP FUND,https://s3.amazonaws.com/irs-form-990/201421579349300602_public.xml
SPECIAL OLYMPICS VERMONT INC,https://s3.amazonaws.com/irs-form-990/201411999349300221_public.xml
DANVILLE VERMONT HISTORICAL SOCIETY INC,https://s3.amazonaws.com/irs-form-990/201442269349301849_public.xml
VSA VERMONT INC FKA VSA ARTS OF VERMONT INC,https://s3.amazonaws.com/irs-form-990/201412189349301201_public.xml
GILL ODD FELLOWS HOME OF VERMONT,https://s3.amazonaws.com/irs-form-990/201442269349301064_public.xml
VERMONT COUNCIL ON PROBLEM GAMBLING INC,https://s3.amazonaws.com/irs-form-990/201422589349200302_public.xml
VISITING NURSE ASSOCIATION AND HOSPICE OF VERMONT AND NEW HAMPSHIRE INC,https://s3.amazonaws.com/irs-form-990/201442199349301574_public.xml
VERMONT SOCIETY OF CERTIFIED PUBLIC ACCOUNTANTS,https://s3.amazonaws.com/irs-form-990/201432559349300343_public.xml
FREE AND ACCEPTED MASONS OF VERMONT GRAND LODGE,https://s3.amazonaws.com/irs-form-990/201411999349300316_public.xml
CENTRAL VERMONT HOME HEALTH AND HOSPICE INC,https://s3.amazonaws.com/irs-form-990/201402199349301615_public.xml
SOUTHWESTERN VERMONT HEALTH CARE AUXILIARY,https://s3.amazonaws.com/irs-form-990/201402199349301660_public.xml
UNIVERSITY OF VERMONT MEDICAL GROUP INC,https://s3.amazonaws.com/irs-form-990/201442269349304224_public.xml
DISABLED AMERICAN VETERANS DEPT OF VERMONT,https://s3.amazonaws.com/irs-form-990/201412559349300236_public.xml
VERMONT PRINCIPALS ASSOCIATION INC,https://s3.amazonaws.com/irs-form-990/201412589349300526_public.xml
VERMONT MOBILE IMAGING INC CO HARTLEY NEEL MD,https://s3.amazonaws.com/irs-form-990/201401229349100010_public.xml
PHYSICIAN ASSISTANT ACADEMY OF VERMONT,https://s3.amazonaws.com/irs-form-990/201440799349100704_public.xml
MAJIC VERMONT FOUNDATION,https://s3.amazonaws.com/irs-form-990/201431269349101008_public.xml
NORDIC EDUCATIONAL TRUST CO VERMONT BUSINESS ROUNDTABLE,https://s3.amazonaws.com/irs-form-990/201401359349101995_public.xml
UNIVERSITY OF VERMONT AND STATE ARG COLLE AUSTIN W AND JANET C LANE SCHOLARSHIP FD,https://s3.amazonaws.com/irs-form-990/201421079349100607_public.xml
TURNING POINT CENTER OF CENTRAL VERMONT,https://s3.amazonaws.com/irs-form-990/201442229349100304_public.xml
VERMONT DIARY PRODUCERS ASSOCIATION INC,https://s3.amazonaws.com/irs-form-990/201441299349102129_public.xml
VERMONT DIARY PRODUCERS ASSOCIATION INC,https://s3.amazonaws.com/irs-form-990/201401799349100100_public.xml
VERMONT CHILDRENS ALLIANCE,https://s3.amazonaws.com/irs-form-990/201401899349100755_public.xml
VERMONT LEADS INC,https://s3.amazonaws.com/irs-form-990/201442239349100234_public.xml
VERMONT LEADS,https://s3.amazonaws.com/irs-form-990/201442239349100234_public.xml
VERMONT HUMANITIES COUNCIL,https://s3.amazonaws.com/irs-form-990/201431349349100548_public.xml
VERMONT WOODLANDS ORGANIZATION,https://s3.amazonaws.com/irs-form-990/201421349349103257_public.xml
VERMONT RURAL EDUCATION COLLABORATIVE INC,https://s3.amazonaws.com/irs-form-990/201411579349100701_public.xml
BLIND ARTISANS OF VERMONT INC,https://s3.amazonaws.com/irs-form-990/201432939349300238_public.xml
ROTARY CLUB OF RUTLAND VERMONT,https://s3.amazonaws.com/irs-form-990/201422889349200902_public.xml
VERMONT JOINT APPRENTICESHIP AND TRAINING TRUST FUND,https://s3.amazonaws.com/irs-form-990/201412809349300831_public.xml
VERMONT VET TO VET INC,https://s3.amazonaws.com/irs-form-990/201432949349300108_public.xml
VERMONT CAPTIVE INSURANCE ASSOCIATION,https://s3.amazonaws.com/irs-form-990/201432879349200838_public.xml
HV NONPROFIT INC CO HOUSING VERMONT,https://s3.amazonaws.com/irs-form-990/201402939349300620_public.xml
DAIRYVISION VERMONT INC,https://s3.amazonaws.com/irs-form-990/201443179349101469_public.xml
VERMONT MAPLE FESTIVAL INC,https://s3.amazonaws.com/irs-form-990/201403289349200315_public.xml
VERMONT VILLAGE COMMUNITY DEVELOPMENT C,https://s3.amazonaws.com/irs-form-990/201403289349200315_public.xml
VERMONT ALCOHOL AND DRUG ABUSE CERTIFICATION BOARD INC,https://s3.amazonaws.com/irs-form-990/201403289349200505_public.xml
VERMONT CONSERVATION VOTERS INC,https://s3.amazonaws.com/irs-form-990/201433159349100728_public.xml
VERMONT STUDENT DEVELOPMENT FUND INC,https://s3.amazonaws.com/irs-form-990/201432809349300728_public.xml
HOUSING VERMONT,https://s3.amazonaws.com/irs-form-990/201423169349301977_public.xml
VERMONT ASSOCIATION FOR THE BLIND AND VISUALLY IMPAIRED,https://s3.amazonaws.com/irs-form-990/201433169349300008_public.xml
VERMONT ARSON TIP AWARD PROGRAM,https://s3.amazonaws.com/irs-form-990/201443299349100504_public.xml
VERMONT NATURAL RESOURCES COUNCIL INC,https://s3.amazonaws.com/irs-form-990/201443169349304134_public.xml
NORTH CENTRAL VERMONT RECOVERY CENTER INC,https://s3.amazonaws.com/irs-form-990/201423299349200417_public.xml
VERMONT SUPERINTENDENTS ASSOCIATION INC,https://s3.amazonaws.com/irs-form-990/201302959349300200_public.xml
VERMONT WOODLANDS ASSOCIATION,https://s3.amazonaws.com/irs-form-990/201342959349300014_public.xml
MAIDEN VERMONT CHORUS,https://s3.amazonaws.com/irs-form-990/201302249349100000_public.xml
VERMONT PARENT REPRESENTATION CENTER INC,https://s3.amazonaws.com/irs-form-990/201302919349200800_public.xml
VERMONT MUSEUM OF NATURAL HISTORY INC,https://s3.amazonaws.com/irs-form-990/201343119349201109_public.xml
SOUTHERN VERMONT HEALTH SERVICE CORP,https://s3.amazonaws.com/irs-form-990/201312269349302716_public.xml
WELFARE BENEFIT PLAN FOR EMPLOYEES OF VERMONT ELECTRIC POWER COMPANY,https://s3.amazonaws.com/irs-form-990/201322739349300672_public.xml
VERMONT CHILDRENS ALLIANCE,https://s3.amazonaws.com/irs-form-990/201302769349300310_public.xml
ROTARY CLUB OF RUTLAND VERMONT,https://s3.amazonaws.com/irs-form-990/201342949349200824_public.xml
PTA GRAND ISLE PTA VERMONT CONGRESS,https://s3.amazonaws.com/irs-form-990/201443109349200449_public.xml
