NAME,URL
VERMONT COUNCIL ON THE ARTS D B A VERMONT ARTS COUNCIL,https://s3.amazonaws.com/irs-form-990/201141409349200214_public.xml
VERMONT BUSINESS ROUNDTABLE INC,https://s3.amazonaws.com/irs-form-990/201141389349300204_public.xml
VERMONT NATURAL RESOURCES COUNCIL INC,https://s3.amazonaws.com/irs-form-990/201141619349200514_public.xml
VERMONT MILITARY FAMILY ASSISTANCE FUNDINC,https://s3.amazonaws.com/irs-form-990/201111529349200506_public.xml
VERMONT GOLF ASSOC SCHOLARSHIP FUND,https://s3.amazonaws.com/irs-form-990/201101459349200200_public.xml
PASSIONIST FOUNDATION OF THE STATE OF VERMONT INC,https://s3.amazonaws.com/irs-form-990/201121939349300427_public.xml
NCDC INC CO HOUSING VERMONT,https://s3.amazonaws.com/irs-form-990/201101819349300425_public.xml
CENTRAL VERMONT COMMUNITY LAND TRUST INC,https://s3.amazonaws.com/irs-form-990/201101669349300025_public.xml
VERMONT NATIONAL GUARD CHARITABLE FOUNDATION INC,https://s3.amazonaws.com/irs-form-990/201141589349300504_public.xml
VERMONT FEDERATION OF NURSES AND HEALTHCARE PROFESSIONALS,https://s3.amazonaws.com/irs-form-990/201141869349200009_public.xml
COMMUNITY CAPITAL OF CENTRAL VERMONT,https://s3.amazonaws.com/irs-form-990/201142289349301389_public.xml
VERMONT COMMITTEE OF NATIONAL MUSEUM OF WOMEN IN THE ARTS,https://s3.amazonaws.com/irs-form-990/201142039349300319_public.xml
VERMONT AUTOMOBILE INSURANCE PLAN,https://s3.amazonaws.com/irs-form-990/201141969349200009_public.xml
OUTRIGHT VERMONT,https://s3.amazonaws.com/irs-form-990/201112169349100406_public.xml
VERMONT SKI AREAS ASSOCIATION,https://s3.amazonaws.com/irs-form-990/201112579349300301_public.xml
EARLE C EST TR FBO UNIV VERMONT,https://s3.amazonaws.com/irs-form-990/201132039349300423_public.xml
NORTH CENTRAL VERMONT RECOVERY CENTER INC,https://s3.amazonaws.com/irs-form-990/201141269349300719_public.xml
VERMONT HAND CRAFTERS INC,https://s3.amazonaws.com/irs-form-990/201131939349200503_public.xml
SMART GROWTH VERMONT,https://s3.amazonaws.com/irs-form-990/201102179349300820_public.xml
BLIND ARTISANS OF VERMONT INC,https://s3.amazonaws.com/irs-form-990/201102159349200725_public.xml
VERMONT PI BETA PHI INC,https://s3.amazonaws.com/irs-form-990/201103189349304375_public.xml
NFI VERMONT INC,https://s3.amazonaws.com/irs-form-990/201133159349300108_public.xml
VERMONT FOSTER ADOPTIVE FAMILY ASSO,https://s3.amazonaws.com/irs-form-990/201113199349306581_public.xml
GOOD STEWARD FOUNDATION OF MORRISVILLE VERMONT INC,https://s3.amazonaws.com/irs-form-990/201123139349200442_public.xml
SPECIAL OLYMPICS VERMONT INC,https://s3.amazonaws.com/irs-form-990/201123139349200817_public.xml
BLUE CROSS AND BLUE SHIELD OF VERMONT CARING FOR CHILDREN FOUNDATION INC,https://s3.amazonaws.com/irs-form-990/201103199349309940_public.xml
CENTRAL VERMONT MEMORIAL CIVIC CENTER INC,https://s3.amazonaws.com/irs-form-990/201123159349303612_public.xml
ASSOCIATION OF VERMONT INDEPENDENT COLLEGES INC,https://s3.amazonaws.com/irs-form-990/201123159349303612_public.xml
VERMONT HOME AND COMMUNITY CARE INC,https://s3.amazonaws.com/irs-form-990/201143149349302374_public.xml
VERMONT SOFTWARE DEVELOPERS ALLIANCE INC,https://s3.amazonaws.com/irs-form-990/201103189349200845_public.xml
HOUSING VERMONT,https://s3.amazonaws.com/irs-form-990/201143059349300504_public.xml
CENTRAL VERMONT HABITAT FOR HUMANITY,https://s3.amazonaws.com/irs-form-990/201133149349303043_public.xml
CENTRAL VERMONT BOARD OF REALTORS,https://s3.amazonaws.com/irs-form-990/201103199349307630_public.xml
ROTARY CLUB OF RUTLAND VERMONT,https://s3.amazonaws.com/irs-form-990/201103199349307630_public.xml
VERMONT FLIGHT ACADEMY INC,https://s3.amazonaws.com/irs-form-990/201143159349300109_public.xml
VERMONT CARIBBEAN INSTITUTE INC,https://s3.amazonaws.com/irs-form-990/201403219349200920_public.xml
AUTISM SOCIETY OF VERMONT,https://s3.amazonaws.com/irs-form-990/201410579349200701_public.xml
VERMONT CLUB ACTIVITIES INC,https://s3.amazonaws.com/irs-form-990/201410229349200406_public.xml
CENTRAL VERMONT WOMENS GIVING CIRCLE,https://s3.amazonaws.com/irs-form-990/201410429349301456_public.xml
VERMONT ENERGY INVESTMENT CORPORATION,https://s3.amazonaws.com/irs-form-990/201403169349300420_public.xml
GOVERNORS INSTITUTES OF VERMONT,https://s3.amazonaws.com/irs-form-990/201402279349300145_public.xml
VERMONT RIVER CONSERVANCY INC,https://s3.amazonaws.com/irs-form-990/201403169349303035_public.xml
HUNGER FREE VERMONT INC,https://s3.amazonaws.com/irs-form-990/201403219349303745_public.xml
VERMONT COMMUNITY ACCESS MEDIA INC,https://s3.amazonaws.com/irs-form-990/201403219349304745_public.xml
NORTHEAST ORGANIC FARMING ASSOCIATION OF VERMONT INC,https://s3.amazonaws.com/irs-form-990/201533179349303038_public.xml
ASSOCIATION OF VERMONT CREDIT UNIONS INC,https://s3.amazonaws.com/irs-form-990/201101339349305555_public.xml
CENTRAL VERMONT CHAMBER MUSIC FESTIVAL,https://s3.amazonaws.com/irs-form-990/201121369349201852_public.xml
VERMONT SUPERINTENDENTS ASSOCIATION INC,https://s3.amazonaws.com/irs-form-990/201142629349300224_public.xml
VERMONT PRINCIPALS ASSOCIATION INC,https://s3.amazonaws.com/irs-form-990/201102699349300005_public.xml
VERMONT GOLF ASSOCIATION,https://s3.amazonaws.com/irs-form-990/201131309349301638_public.xml
FIBER ARTS IN VERMONT INC,https://s3.amazonaws.com/irs-form-990/201111339349303101_public.xml
TURNING POINT CENTER OF CENTRAL VERMONT,https://s3.amazonaws.com/irs-form-990/201102789349300505_public.xml
VERMONT COUNCIL ON WORLD AFFAIRS INC,https://s3.amazonaws.com/irs-form-990/201401349349306510_public.xml
VERMONT MEDICAL SOCIETY,https://s3.amazonaws.com/irs-form-990/201401359349300510_public.xml
CENTRAL VERMONT WOMENS GIVING CIRCLE,https://s3.amazonaws.com/irs-form-990/201402199349301020_public.xml
CENTRAL VERMONT HIGH SCHOOL INITIATIVE,https://s3.amazonaws.com/irs-form-990/201533209349308323_public.xml
VERMONT MORGAN HORSE ASSOCIATION IN,https://s3.amazonaws.com/irs-form-990/201401349349203470_public.xml
NORTHEASTERN VERMONT REGIONAL CORP,https://s3.amazonaws.com/irs-form-990/201402239349300030_public.xml
VERMONT PROGRAM FOR QUALITY IN HEALTH CARE INC,https://s3.amazonaws.com/irs-form-990/201333549349300928_public.xml
YWCA OF VERMONT INC,https://s3.amazonaws.com/irs-form-990/201143199349310559_public.xml
VERMONT CONSERVATION EDUCATION FUND,https://s3.amazonaws.com/irs-form-990/201133199349201693_public.xml
VERMONT SENIORS,https://s3.amazonaws.com/irs-form-990/201143229349300514_public.xml
BRAIN INJURY ASSOCIATION OF VERMONT INC,https://s3.amazonaws.com/irs-form-990/201143209349301104_public.xml
NORTHWESTERN VERMONT BOARD OF REALTORS,https://s3.amazonaws.com/irs-form-990/201133199349304728_public.xml
VERMONT COLLEGE CAMPUS FOUNDATION INC,https://s3.amazonaws.com/irs-form-990/201143189349306359_public.xml
VERMONT NURSERY AND LANDSCAPE ASSOCIATION INC DBA GREEN WORKS THE VERMONT NURSE,https://s3.amazonaws.com/irs-form-990/201143199349309989_public.xml
SOMALI BANTU COMMUNITY ASSOCIATION OF VERMONT INC,https://s3.amazonaws.com/irs-form-990/201113129349302406_public.xml
VERMONT SUZUKI VIOLINS INC,https://s3.amazonaws.com/irs-form-990/201113129349302406_public.xml
AUTISM SOCIETY OF VERMONT,https://s3.amazonaws.com/irs-form-990/201123189349202932_public.xml
VERMONT VILLAGE COMMUNITY DEVELOPMENT CORP INC,https://s3.amazonaws.com/irs-form-990/201123129349302007_public.xml
VERMONT WORKS FOR WOMEN INC,https://s3.amazonaws.com/irs-form-990/201133199349310073_public.xml
KAPPA SIGMA FRATERNITY UNIVERSITY OF VERMONT - ALPHA LAMBDA,https://s3.amazonaws.com/irs-form-990/201112879349200806_public.xml
VERMONT COMMUNITY LOAN FUND,https://s3.amazonaws.com/irs-form-990/201103009349300905_public.xml
VERMONT INSTITUTE ON THE CARIBBEAN,https://s3.amazonaws.com/irs-form-990/201131689349200008_public.xml
VERMONT FOLKLIFE CENTER,https://s3.amazonaws.com/irs-form-990/201122939349300117_public.xml
VERMONT HOUSING MANAGERS ASSOC INC,https://s3.amazonaws.com/irs-form-990/201101839349200100_public.xml
UNITED WAYS OF VERMONT INC,https://s3.amazonaws.com/irs-form-990/201102939349301305_public.xml
SOUTHERN VERMONT ARTS CENTER INC,https://s3.amazonaws.com/irs-form-990/201103189349305885_public.xml
VERMONT MAPLE FESTIVAL INC,https://s3.amazonaws.com/irs-form-990/201113229349300516_public.xml
VERMONT CLUB CHARITIES INC,https://s3.amazonaws.com/irs-form-990/201113199349203586_public.xml
VERMONT ATV SPORTSMANS ASSOCIATION INC,https://s3.amazonaws.com/irs-form-990/201113199349307941_public.xml
VERMONT PLUMBERS AND PIPEFITTERS LABOR MANAGEMENT FUND,https://s3.amazonaws.com/irs-form-990/201133189349302888_public.xml
VERMONT CLUB ACTIVITIES INC,https://s3.amazonaws.com/irs-form-990/201133199349305903_public.xml
VERMONT ACTIVE CHAPTER OF SIGMA PHI SOCIETY,https://s3.amazonaws.com/irs-form-990/201133199349305903_public.xml
EPILEPSY FOUNDATION OF VERMONT INC,https://s3.amazonaws.com/irs-form-990/201143159349201129_public.xml
VERMONT ASSOCIATION FOR THE BLIND AND VISUALLY IMPAIRED,https://s3.amazonaws.com/irs-form-990/201103199349306995_public.xml
AMERICAN CIVIL LIBERTIES UNION FOUNDATION OF VERMONT INC,https://s3.amazonaws.com/irs-form-990/201123189349305277_public.xml
VERMONT VET TO VET INC,https://s3.amazonaws.com/irs-form-990/201113199349200346_public.xml
VERMONT DENTAL FOUNDATION,https://s3.amazonaws.com/irs-form-990/201113189349101351_public.xml
DRAGONHEART VERMONT INC,https://s3.amazonaws.com/irs-form-990/201123189349100417_public.xml
VERMONT STUDIO CENTER INC,https://s3.amazonaws.com/irs-form-990/201113189349200311_public.xml
AMERICAN CIVIL LIBERTIES UNION OF VERMONT INC,https://s3.amazonaws.com/irs-form-990/201113189349308201_public.xml
VERMONT SUSTAINABLE JOBS FUND INC,https://s3.amazonaws.com/irs-form-990/201113189349301446_public.xml
VERMONT WOOD MANUFACTURERS ASSOCIATION,https://s3.amazonaws.com/irs-form-990/201113189349201426_public.xml
VERMONT STATE KNIGHTS OF COLUMBUS,https://s3.amazonaws.com/irs-form-990/201123209349300937_public.xml
VERMONT JOINT APPRENTICESHIP AND TRAINING TRUST FUND,https://s3.amazonaws.com/irs-form-990/201113189349300521_public.xml
PRESERVATION TRUST OF VERMONT INC,https://s3.amazonaws.com/irs-form-990/201532269349302478_public.xml
PREVENT CHILD ABUSE - VERMONT,https://s3.amazonaws.com/irs-form-990/201523099349300142_public.xml
HOME BUILDERS AND ASSOCIATION OF NORTHERN VERMONT INC,https://s3.amazonaws.com/irs-form-990/201543159349302289_public.xml
UNIVERSITY OF VERMONT HEALTH NETWORK INC,https://s3.amazonaws.com/irs-form-990/201542299349200339_public.xml
CENTRAL VERMONT MEDICAL CENTER INC,https://s3.amazonaws.com/irs-form-990/201532269349301213_public.xml
VERMONT PRINCIPALS ASSOCIATION INC,https://s3.amazonaws.com/irs-form-990/201503089349300940_public.xml
VERMONT TRAPPERS ASSOCIATION INC,https://s3.amazonaws.com/irs-form-990/201542379349300744_public.xml
VERMONT INDEPENDENT SCHOOL OF THE ARTS INC,https://s3.amazonaws.com/irs-form-990/201512539349200716_public.xml
VERMONT CENTER FOR EMERGING TECHNOLOGIES INC,https://s3.amazonaws.com/irs-form-990/201413039349301246_public.xml
VERMONT STUDIO CENTER INC,https://s3.amazonaws.com/irs-form-990/201412029349300341_public.xml
OVERMONT CORP,https://s3.amazonaws.com/irs-form-990/201533179349304058_public.xml
VERMONT ADAPTIVE SKI AND SPORTS FOUNDATION VERMONT ADAPTIVE SKI AND SPORTS FOUNDATI,https://s3.amazonaws.com/irs-form-990/201412589349300106_public.xml
SOUTHWESTERN VERMONT HEALTH CARE CORPORATION,https://s3.amazonaws.com/irs-form-990/201412249349301311_public.xml
VERMONT-OXFORD NETWORK,https://s3.amazonaws.com/irs-form-990/201413099349301336_public.xml
VERMONT MIDI PROJECT INC,https://s3.amazonaws.com/irs-form-990/201133069349200308_public.xml
VERMONT CENTER FOR THE DEAF AND HARD OF HEARING INC,https://s3.amazonaws.com/irs-form-990/201103139349300505_public.xml
VERMONT FUEL DEALERS ASSOCIATION,https://s3.amazonaws.com/irs-form-990/201103049349300835_public.xml
VERMONT STUDENT DEVELOPMENT FUND,https://s3.amazonaws.com/irs-form-990/201133049349300518_public.xml
VERMONT STATE AMATEUR HOCKEY ASSOCIATION,https://s3.amazonaws.com/irs-form-990/201143009349301004_public.xml
VERMONT INSTITUTES INC,https://s3.amazonaws.com/irs-form-990/201123119349300617_public.xml
VERMONT DATA CONSORTIUM INC,https://s3.amazonaws.com/irs-form-990/201143009349300804_public.xml
VERMONT NEW HAMPSHIRE MARKETING GROUP INC,https://s3.amazonaws.com/irs-form-990/201143049349200309_public.xml
PREVENT CHILD ABUSE-VERMONT,https://s3.amazonaws.com/irs-form-990/201142999349300804_public.xml
PATIENT CHOICES AT END OF LIFE VERMONT INC,https://s3.amazonaws.com/irs-form-990/201123129349301222_public.xml
VERMONT RIVER CONSERVANCY INC,https://s3.amazonaws.com/irs-form-990/201102579349200435_public.xml
VERMONT SUSTAINABLE JOBS FUND INC,https://s3.amazonaws.com/irs-form-990/201102579349200435_public.xml
VERMONT FOSTERADOPTIVE FAMILY ASSO,https://s3.amazonaws.com/irs-form-990/201103069349300505_public.xml
CVPS EMPLOYEE BENEFITS TRUST FOR CENTRAL VERMONT PUBLIC SERVICE,https://s3.amazonaws.com/irs-form-990/201143089349301109_public.xml
VERMONT LIGHTNING GIRLS BASKETBALL CLUB INC,https://s3.amazonaws.com/irs-form-990/201103149349303760_public.xml
VERMONT-OXFORD NETWORK,https://s3.amazonaws.com/irs-form-990/201133149349301438_public.xml
VERMONT STATE GRANGE INC,https://s3.amazonaws.com/irs-form-990/201430449349300548_public.xml
VERMONT CATHOLIC CHARITIES INC,https://s3.amazonaws.com/irs-form-990/201423169349302167_public.xml
VERMONT BANKERS ASSOCIATION INC,https://s3.amazonaws.com/irs-form-990/201423579349300422_public.xml
VERMONT LONG TERM DISASTER RECOVERY GROUP INC,https://s3.amazonaws.com/irs-form-990/201423169349304577_public.xml
VERMONT AFTERSCHOOL INC,https://s3.amazonaws.com/irs-form-990/201423149349301937_public.xml
NORTHEASTERN VERMONT REGIONAL HOSP INC,https://s3.amazonaws.com/irs-form-990/201422239349300127_public.xml
VERMONT COMMUNITY LOAN FUND,https://s3.amazonaws.com/irs-form-990/201421359349301422_public.xml
VERMONT NETWORK AGAINST DOMESTIC AND SEXUAL VIOLENCE INC,https://s3.amazonaws.com/irs-form-990/201421779349300012_public.xml
VERMONT VETERINARY MEDICAL,https://s3.amazonaws.com/irs-form-990/201421959349301707_public.xml
VERMONT SYMPHONY ORCHESTRA ASSOCIATION INC,https://s3.amazonaws.com/irs-form-990/201421969349300102_public.xml
SOUTHWESTERN VERMONT MEDICAL CENTER,https://s3.amazonaws.com/irs-form-990/201422199349301702_public.xml
VERMONT HEALTH SERVICES GROUP,https://s3.amazonaws.com/irs-form-990/201421349349201472_public.xml
VERMONT HISTORICAL SOCIETY,https://s3.amazonaws.com/irs-form-990/201420449349301217_public.xml
CENTRAL VERMONT ADULT BASIC EDUC INC,https://s3.amazonaws.com/irs-form-990/201413179349305856_public.xml
CENTRAL VERMONT COMMUNITY TELEVISION,https://s3.amazonaws.com/irs-form-990/201420449349301757_public.xml
CENTRAL VERMONT COUNCIL ON AGING INC,https://s3.amazonaws.com/irs-form-990/201420389349300002_public.xml
VERMONT FUNERAL DIRECTORS AND EMBALMERS ASSOCIATION,https://s3.amazonaws.com/irs-form-990/201420229349200412_public.xml
VERMONT SOCIETY OF HEALTH SYSTEM PHARMACISTS INC,https://s3.amazonaws.com/irs-form-990/201421149349200102_public.xml
CENTRAL VERMONT CHAMBER OF COMMERCE INC,https://s3.amazonaws.com/irs-form-990/201413189349304041_public.xml
VERMONT HAND CRAFTERS INC,https://s3.amazonaws.com/irs-form-990/201432039349200308_public.xml
VNA HEALTH SYSTEMS OF VERMONT,https://s3.amazonaws.com/irs-form-990/201431149349200018_public.xml
VERMONT INTERFAITH ACTION INC,https://s3.amazonaws.com/irs-form-990/201431149349200703_public.xml
VERMONT RECOVERY NETWORK INC,https://s3.amazonaws.com/irs-form-990/201431009349300528_public.xml
RIVERMONT COLLEGIATE,https://s3.amazonaws.com/irs-form-990/201431339349301348_public.xml
VERMONT CONSERVATORY OF MUSIC INC,https://s3.amazonaws.com/irs-form-990/201431329349301948_public.xml
VERMONT ASSOCIATION OF REALTORS DBA VERMONT REALTORS,https://s3.amazonaws.com/irs-form-990/201431329349302228_public.xml
VERMONT MEDICAL SOCIETY EDUCATION AND RESEARCH FOUNDATION INC,https://s3.amazonaws.com/irs-form-990/201431359349203123_public.xml
VERMONT MOTORCROSS ASSOCIATION,https://s3.amazonaws.com/irs-form-990/201431119349200303_public.xml
VERMONT ATV SPORTSMANS ASSOCIATION INC,https://s3.amazonaws.com/irs-form-990/201442529349300134_public.xml
VERMONT BREWERS ASSOCIATION INC,https://s3.amazonaws.com/irs-form-990/201442259349302904_public.xml
VERMONT FARM TO SCHOOL INC,https://s3.amazonaws.com/irs-form-990/201440459349301819_public.xml
VERMONT CENTER FOR INDEPENDENT LIVING,https://s3.amazonaws.com/irs-form-990/201440739349300504_public.xml
VERMONT BUSINESS ROUNDTABLE INC,https://s3.amazonaws.com/irs-form-990/201441339349302714_public.xml
VERMONT COUNCIL OF DEVELOPMENTAL AND MENTAL HEALTH SERVICES INC,https://s3.amazonaws.com/irs-form-990/201440299349300529_public.xml
CENTRAL VERMONT COMMUNITY LAND TRUST INC,https://s3.amazonaws.com/irs-form-990/201441149349300504_public.xml
YOUTH SAFETY COUNCIL OF VERMONT,https://s3.amazonaws.com/irs-form-990/201441329349201634_public.xml
BLUE CROSS AND BLUE SHIELD OF VERMONT CARING FOR CHILDREN FOUNDATION INC,https://s3.amazonaws.com/irs-form-990/201432949349300503_public.xml
VERMONT INDEPENDENT SCHOOL OF THE ARTS INC,https://s3.amazonaws.com/irs-form-990/201432829349200328_public.xml
VERMONT COLLEGE OF FINE ARTS INC,https://s3.amazonaws.com/irs-form-990/201433189349302383_public.xml
HOMESHARE VERMONT INC,https://s3.amazonaws.com/irs-form-990/201432699349300103_public.xml
PASSIONIST FOUNDATION OF THE STATE OF VERMONT INC,https://s3.amazonaws.com/irs-form-990/201443169349300869_public.xml
VERMONT ASSEMBLY OF HOME HEALTH AND HOSPICE AGENCIES INC DBA VNAS OF VT,https://s3.amazonaws.com/irs-form-990/201443189349302124_public.xml
ASSOCIATION OF AFRICANS LIVING IN VERMONT INC,https://s3.amazonaws.com/irs-form-990/201443189349303984_public.xml
VERMONT COMMONS SCHOOL,https://s3.amazonaws.com/irs-form-990/201533179349302218_public.xml
VERMONT POLICE CANINE ASSOCIATION,https://s3.amazonaws.com/irs-form-990/201023293491005020_public.xml
VERMONT WOOD PRODUCTS MARKETING COUNCIL INC,https://s3.amazonaws.com/irs-form-990/201022193492003010_public.xml
VERMONT EMERGENCY NURSES ASSOCIATION,https://s3.amazonaws.com/irs-form-990/201102219349201300_public.xml
NORTHERN VERMONT BASEBALL UMPIRES ASSOCIATION INC,https://s3.amazonaws.com/irs-form-990/201513429349200001_public.xml
CENTRAL VERMONT COMMUNITY LAND TRUST INC,https://s3.amazonaws.com/irs-form-990/201015893493003500_public.xml
VERMONT RURAL EDUCATION COLLABORATIVE INC,https://s3.amazonaws.com/irs-form-990/201024593492004010_public.xml
DELTA DENTAL PLAN OF VERMONT INC,https://s3.amazonaws.com/irs-form-990/201025893493000250_public.xml
VERMONT SKI AREAS ASSOCIATION,https://s3.amazonaws.com/irs-form-990/201023893493002080_public.xml
VERMONT CONSERVATORY OF MUSIC INC,https://s3.amazonaws.com/irs-form-990/201023893493002080_public.xml
HOMESHARE VERMONT INC,https://s3.amazonaws.com/irs-form-990/201025693492005020_public.xml
FREE ACCEPTED MASONS OF VERMONT 37 MORNING STAR,https://s3.amazonaws.com/irs-form-990/201111799349300121_public.xml
VERMONT BALLET THEATER INC,https://s3.amazonaws.com/irs-form-990/201111369349202501_public.xml
PHYSICIAN ASSISTANT ACADEMY OF VERMONT,https://s3.amazonaws.com/irs-form-990/201111339349300436_public.xml
VERMONT LAW SCHOOL,https://s3.amazonaws.com/irs-form-990/201110429349300136_public.xml
VERMONT COMMONS SCHOOL,https://s3.amazonaws.com/irs-form-990/201110199349301051_public.xml
UNIVERSITY OF VERMONT AND STATE ARG COLLE AUSTIN W AND JANET C LANE SCHOLARSHIP FD,https://s3.amazonaws.com/irs-form-990/201111279349100101_public.xml
VERMONT JAZZ CENTER INC,https://s3.amazonaws.com/irs-form-990/201130429349200223_public.xml
VERMONT PUBLIC INTEREST RESEARCH AND EDUCATION FUND,https://s3.amazonaws.com/irs-form-990/201122279349300547_public.xml
VERMONT LAND TRUST INC,https://s3.amazonaws.com/irs-form-990/201130219349300213_public.xml
NORTHEASTERN VERMONT REGIONAL CORP,https://s3.amazonaws.com/irs-form-990/201122279349302962_public.xml
VERMONT PUBLIC RADIO,https://s3.amazonaws.com/irs-form-990/201120989349300102_public.xml
BROC-COMMUNITY ACTION IN SOUTHWESTERN VERMONT,https://s3.amazonaws.com/irs-form-990/201121329349303067_public.xml
VERMONT DENTAL CARE PROGRAMS INC,https://s3.amazonaws.com/irs-form-990/201121029349300527_public.xml
CENTRAL VERMONT ARC,https://s3.amazonaws.com/irs-form-990/201121039349200117_public.xml
VERMONT NURSES IN PARTNERSHIP INC,https://s3.amazonaws.com/irs-form-990/201130389349200513_public.xml
VERMONT COVERTS WOODLANDS FOR WILDLIFE INC,https://s3.amazonaws.com/irs-form-990/201122209349201117_public.xml
NORTHERN VERMONT RESOURCE CONSERVATION AND DEVELOPMENT COUNCIL,https://s3.amazonaws.com/irs-form-990/201121339349304652_public.xml
VERMONT GOVERNORS COUNCIL ON PHYSICAL FITNESS AND SPORTS,https://s3.amazonaws.com/irs-form-990/201140129349201064_public.xml
VERMONT QUARTER HORSE ASSOCIATION INCORPORATED,https://s3.amazonaws.com/irs-form-990/201132229349201053_public.xml
VERMONT STATE EMPLOYEES CREDIT UNION,https://s3.amazonaws.com/irs-form-990/201131329349302053_public.xml
VERMONT BEEF INDUSTRY COUNCIL INC,https://s3.amazonaws.com/irs-form-990/201141349349200304_public.xml
VERMONT ASSOCIATION OF HOSPITALS AND HEALTH SYSTEMS,https://s3.amazonaws.com/irs-form-990/201140429349300329_public.xml
COMPOSTING ASSOCIATION OF VERMONT,https://s3.amazonaws.com/irs-form-990/201141309349301439_public.xml
VERMONT INDEPENDENT MEDIA INC,https://s3.amazonaws.com/irs-form-990/201141999349300519_public.xml
CENTRAL VERMONT MEDICAL CENTER INC CREDIT UNION,https://s3.amazonaws.com/irs-form-990/201141319349301319_public.xml
VERMONT FEDERATION OF FAMILIES FOR CHILDRENS MENTAL HEALTH INC,https://s3.amazonaws.com/irs-form-990/201140359349300509_public.xml
VERMONT ANTIQUE AUTOMOBILE SOCIETY INC,https://s3.amazonaws.com/irs-form-990/201142229349200834_public.xml
VERMONT VOLUNTEER SERVICES FOR ANIMALS HUMANE SOCIETY,https://s3.amazonaws.com/irs-form-990/201203079349200600_public.xml
NCDC INC CO HOUSING VERMONT,https://s3.amazonaws.com/irs-form-990/201203319349300315_public.xml
FAMILIES FIRST IN SOUTHERN VERMONT INC,https://s3.amazonaws.com/irs-form-990/201203209349301310_public.xml
DELTA DENTAL PLAN OF VERMONT INC,https://s3.amazonaws.com/irs-form-990/201203179349301355_public.xml
CENTRAL VERMONT BOARD OF REALTORS,https://s3.amazonaws.com/irs-form-990/201212239349200701_public.xml
MASONIC CHARITIES OF VERMONT INC,https://s3.amazonaws.com/irs-form-990/201212349349200301_public.xml
NFI VERMONT INC,https://s3.amazonaws.com/irs-form-990/201213179349301076_public.xml
VERMONT CONTEMPORARY MUSIC ENSEMBLE INC,https://s3.amazonaws.com/irs-form-990/201233129349200008_public.xml
VERMONT COUNCIL OF THE BLIND,https://s3.amazonaws.com/irs-form-990/201222419349200512_public.xml
VERMONT MAPLE SUGAR MAKERS ASSOC INC,https://s3.amazonaws.com/irs-form-990/201232619349300013_public.xml
VERMONT HEALTH SERVICES GROUP,https://s3.amazonaws.com/irs-form-990/201231359349201778_public.xml
VERMONT NATURAL RESOURCES COUNCIL INC,https://s3.amazonaws.com/irs-form-990/201233209349307853_public.xml
VERMONT COMMUNITY LOAN FUND,https://s3.amazonaws.com/irs-form-990/201232159349300448_public.xml
ROTARY CLUB CHARITIES OF ESSEX VERMONT INC,https://s3.amazonaws.com/irs-form-990/201223059349200627_public.xml
VERMONT ARTS EXCHANGE INC,https://s3.amazonaws.com/irs-form-990/201232239349300513_public.xml
VERMONT CENTER FOR THE DEAF AND HARD OF HEARING INC,https://s3.amazonaws.com/irs-form-990/201233049349301213_public.xml
VERMONT ASSOCIATION OF REALTORS INC,https://s3.amazonaws.com/irs-form-990/201232289349301328_public.xml
VERMONT RETAIL ASSOCIATION INC,https://s3.amazonaws.com/irs-form-990/201222909349300307_public.xml
VERMONT BUSINESSES FOR SOCIAL RESPONSIBI RESEARCH AND EDUCATION FOUNDATION,https://s3.amazonaws.com/irs-form-990/201223119349200632_public.xml
VERMONT ADAPTIVE SKI AND SPORTS FOUNDATION,https://s3.amazonaws.com/irs-form-990/201232579349300208_public.xml
VERMONT SOFTWARE DEVELOPERS ALLIANCE INC,https://s3.amazonaws.com/irs-form-990/201233119349200133_public.xml
VERMONT RETAIL ASSOCIATION INC,https://s3.amazonaws.com/irs-form-990/201123129349300537_public.xml
VERMONT INDEPENDENT MEDIA INC,https://s3.amazonaws.com/irs-form-990/201241359349306819_public.xml
SOUTHERN VERMONT HEALTH SERVICE CORP,https://s3.amazonaws.com/irs-form-990/201112249349301606_public.xml
VERMONT STATE DENTAL SOCIETY,https://s3.amazonaws.com/irs-form-990/201242649349300014_public.xml
VERMONT CONGREGATIONAL HOME INC,https://s3.amazonaws.com/irs-form-990/201241359349300229_public.xml
VERMONT ACTORS REPERTORY THEATRE COMPANY,https://s3.amazonaws.com/irs-form-990/201243319349200309_public.xml
VSA VERMONT INC,https://s3.amazonaws.com/irs-form-990/201220749349300647_public.xml
VERMONT ASSOCIATION OF WEDDING PROFESSIONALS CO JOHN CRABBE,https://s3.amazonaws.com/irs-form-990/201212219349200736_public.xml
VERMONT JOURNALISM TRUST,https://s3.amazonaws.com/irs-form-990/201211649349300601_public.xml
VERMONT ASSEMBLY OF HOME HEALTH AND HOSPICE AGENCIES INC,https://s3.amazonaws.com/irs-form-990/201213199349300231_public.xml
VERMONT POLICE CANINE ASSOCIATION,https://s3.amazonaws.com/irs-form-990/201221219349200132_public.xml
DRAGONHEART VERMONT INC,https://s3.amazonaws.com/irs-form-990/201211369349300111_public.xml
VERMONT DAIRY HERD IMPROVEMENT ASSOCIATION,https://s3.amazonaws.com/irs-form-990/201213429349300106_public.xml
STARBASE VERMONT INCORPORATED,https://s3.amazonaws.com/irs-form-990/201230619349201373_public.xml
SOUTHEASTERN VERMONT COMMUNITY ACTION INC,https://s3.amazonaws.com/irs-form-990/201221789349300342_public.xml
VERMONT QUARTER HORSE ASSOCIATION INCORPORATED,https://s3.amazonaws.com/irs-form-990/201221359349202057_public.xml
