NAME,URL
ASSOCIATION OF AFRICANS LIVING IN VERMONT INC,https://s3.amazonaws.com/irs-form-990/201523169349304497_public.xml
VERMONT CHEESE COUNCIL INC,https://s3.amazonaws.com/irs-form-990/201503039349200805_public.xml
VERMONT BANKERS ASSOCIATION INC,https://s3.amazonaws.com/irs-form-990/201523149349303302_public.xml
TURNING POINT CENTER OF CENTRAL VERMONT,https://s3.amazonaws.com/irs-form-990/201523159349200522_public.xml
BLIND ARTISANS OF VERMONT INC,https://s3.amazonaws.com/irs-form-990/201523159349200522_public.xml
SOUTHEASTERN VERMONT ECONOMIC DEVELOPMENT STRATEGIES INC,https://s3.amazonaws.com/irs-form-990/201523159349200522_public.xml
HABITAT FOR HUMANITY OF RUTLAND COUNTY VERMONT INC,https://s3.amazonaws.com/irs-form-990/201512889349100716_public.xml
CVPS EMPLOYEE BENEFITS TRUST FOR CENTRAL VERMONT PUBLIC SERVICE,https://s3.amazonaws.com/irs-form-990/201502969349200510_public.xml
CVPS EMPLOYEE BENEFITS TRUST FOR CENTRAL VERMONT PUBLIC SERVICE,https://s3.amazonaws.com/irs-form-990/201502969349200510_public.xml
CENTRAL VERMONT BOARD OF REALTORS,https://s3.amazonaws.com/irs-form-990/201542589349200339_public.xml
VERMONT COUNCIL OF DEVELOPMENTAL AND MENTAL HEALTH SERVICES INC,https://s3.amazonaws.com/irs-form-990/201532789349300723_public.xml
HOMESHARE VERMONT INC,https://s3.amazonaws.com/irs-form-990/201542809349300209_public.xml
VERMONT DAIRY PRODUCERS ASSOCIATION INC,https://s3.amazonaws.com/irs-form-990/201502819349200725_public.xml
VERMONT ADAPTIVE SKI AND SPORTS FOUNDATION VERMONT ADAPTIVE SKI AND SPORTS FOUNDATI,https://s3.amazonaws.com/irs-form-990/201522579349300302_public.xml
KAPPA SIGMA FRATERNITY UNIVERSITY OF VERMONT - ALPHA LAMBDA,https://s3.amazonaws.com/irs-form-990/201522859349200507_public.xml
VERMONT CARIBBEAN INSTITUTE INC,https://s3.amazonaws.com/irs-form-990/201522999349200127_public.xml
VERMONTS CAMP TA KUM TA,https://s3.amazonaws.com/irs-form-990/201503179349301380_public.xml
HV NONPROFIT INC CO HOUSING VERMONT,https://s3.amazonaws.com/irs-form-990/201503179349306395_public.xml
VERMONT ADULT LEARNING,https://s3.amazonaws.com/irs-form-990/201503209349305095_public.xml
FAMILIES FIRST IN SOUTHERN VERMONT INC,https://s3.amazonaws.com/irs-form-990/201503179349306810_public.xml
ASSOCIATION OF VERMONT INDEPENDENT COLLEGES INC,https://s3.amazonaws.com/irs-form-990/201503249349200605_public.xml
VERMONT POLICE CANINE ASSOCIATION,https://s3.amazonaws.com/irs-form-990/201503179349202715_public.xml
VERMONT PHARMACISTS ASSOCIATION,https://s3.amazonaws.com/irs-form-990/201503489349200715_public.xml
VERMONT INDEPENDENT ELECTRICAL CONTRACTORS ASSOCIATION INC,https://s3.amazonaws.com/irs-form-990/201533499349200148_public.xml
VERMONT PARENT REPRESENTATION CENTER INC,https://s3.amazonaws.com/irs-form-990/201503429349200420_public.xml
CENTRAL VERMONT ADULT BASIC EDUC INC,https://s3.amazonaws.com/irs-form-990/201513199349300136_public.xml
VERMONT CENTER FOR EMERGING TECHNOLOGIES INC,https://s3.amazonaws.com/irs-form-990/201523179349301887_public.xml
ROTARY CLUB OF MIDDLEBURY VERMONT INC,https://s3.amazonaws.com/irs-form-990/201513209349200246_public.xml
VERMONT FEED DEALERS AND MANUFACTURERS ASSOCIATION INC,https://s3.amazonaws.com/irs-form-990/201513179349200121_public.xml
BLUE CROSS AND BLUE SHIELD OF VERMONT CARING FOR CHILDREN FOUNDATION INC,https://s3.amazonaws.com/irs-form-990/201513179349100936_public.xml
VERMONT COMMUNITY GARDEN NETWORK INC,https://s3.amazonaws.com/irs-form-990/201523209349305512_public.xml
SOUTHERN VERMONT AREA HEALTH EDUCATION CENTER INC,https://s3.amazonaws.com/irs-form-990/201523209349100432_public.xml
VERMONT INSTITUTE OF NATURAL SCIENCE,https://s3.amazonaws.com/irs-form-990/201523209349300022_public.xml
VERMONT ATTRACTIONS ASSOCIATION INC,https://s3.amazonaws.com/irs-form-990/201503439349300725_public.xml
SPECIAL OLYMPICS VERMONT INC,https://s3.amazonaws.com/irs-form-990/201502949349301100_public.xml
VERMONT AFTERSCHOOL INC,https://s3.amazonaws.com/irs-form-990/201522949349300532_public.xml
YOUNG TRADITION VERMONT INC,https://s3.amazonaws.com/irs-form-990/201513129349200101_public.xml
VERMONT WORKS FOR WOMEN INC,https://s3.amazonaws.com/irs-form-990/201513169349301791_public.xml
BEVERLY-VERMONT COMMUNITY LAND TRUST,https://s3.amazonaws.com/irs-form-990/201513129349300206_public.xml
VERMONT BAR FOUNDATION,https://s3.amazonaws.com/irs-form-990/201512949349300101_public.xml
VERMONT HOME AND COMMUNITY CARE INC,https://s3.amazonaws.com/irs-form-990/201502929349200300_public.xml
VERMONT PUBLIC INTEREST RESEARCH GROUP INC,https://s3.amazonaws.com/irs-form-990/201503109349302210_public.xml
VERMONT RURAL LETTER CARRIERS ASSOCIATION,https://s3.amazonaws.com/irs-form-990/201502939349200300_public.xml
VERMONT SCHOOL BOARDS ASSOCIATION,https://s3.amazonaws.com/irs-form-990/201513169349300601_public.xml
VERMONT RECREATION AND PARK ASSOCIATION,https://s3.amazonaws.com/irs-form-990/201503449349200400_public.xml
VERMONT MUSEUM OF NATURAL HISTORY INC,https://s3.amazonaws.com/irs-form-990/201513149349201316_public.xml
VERMONT ETHICS NETWORK INC,https://s3.amazonaws.com/irs-form-990/201512949349300501_public.xml
BRAIN INJURY ASSOCIATION OF VERMONT INC,https://s3.amazonaws.com/irs-form-990/201513159349302921_public.xml
VERMONT RECOVERY NETWORK INC,https://s3.amazonaws.com/irs-form-990/201513169349305156_public.xml
CENTRAL VERMONT MEMORIAL CIVIC CENTER INC,https://s3.amazonaws.com/irs-form-990/201523149349300407_public.xml
VERMONT-OXFORD NETWORK,https://s3.amazonaws.com/irs-form-990/201513109349300136_public.xml
CENTRAL VERMONT SKATING ASSOCIATION,https://s3.amazonaws.com/irs-form-990/201513149349200701_public.xml
SOUTHERN VERMONT THERAPEUTIC RIDING CENTER INC,https://s3.amazonaws.com/irs-form-990/201513169349301401_public.xml
VERMONT NEW HAMPSHIRE MARKETING,https://s3.amazonaws.com/irs-form-990/201513139349201206_public.xml
VERMONT PUBLIC INTEREST RESEARCH AND EDUCATION FUND,https://s3.amazonaws.com/irs-form-990/201523109349302132_public.xml
VERMONT INDEPENDENT MEDIA INC,https://s3.amazonaws.com/irs-form-990/201523169349302247_public.xml
DELTA DENTAL PLAN OF VERMONT INC,https://s3.amazonaws.com/irs-form-990/201523169349301067_public.xml
VERMONT COUNCIL ON THE ARTS INC,https://s3.amazonaws.com/irs-form-990/201523139349302412_public.xml
UNIVERSITY OF VERMONT MEDICAL CENTER INC,https://s3.amazonaws.com/irs-form-990/201532299349302568_public.xml
VERMONTERS FOR HEALTH CARE FREEDOM INC,https://s3.amazonaws.com/irs-form-990/201532269349201633_public.xml
VERMONT HEALTHCARE INFORMATION TECHNOLOGY EDUCATION CENTER INC,https://s3.amazonaws.com/irs-form-990/201543169349304759_public.xml
VERMONT LONG TERM DISASTER RECOVERY GROUP INC,https://s3.amazonaws.com/irs-form-990/201543169349304954_public.xml
PASSIONIST FOUNDATION OF THE STATE OF VERMONT INC,https://s3.amazonaws.com/irs-form-990/201543169349304969_public.xml
VERMONT MARBLE MUSEUM INC,https://s3.amazonaws.com/irs-form-990/201543169349300314_public.xml
VERMONT COLLEGE OF FINE ARTS FOUNDATION INC,https://s3.amazonaws.com/irs-form-990/201543169349300314_public.xml
JOBS WITH JUSTICE INC VERMONT WORKERS CENTER,https://s3.amazonaws.com/irs-form-990/201543169349300314_public.xml
GAY AND LESBIAN FUND OF VERMONT INC,https://s3.amazonaws.com/irs-form-990/201543169349300314_public.xml
VERMONT MUSIC AND ARTS ASSOCIATION INC,https://s3.amazonaws.com/irs-form-990/201543169349300314_public.xml
VERMONT HIGHER EDUCATION COUNCIL,https://s3.amazonaws.com/irs-form-990/201543169349300314_public.xml
AFT VERMONT LOCAL 8043,https://s3.amazonaws.com/irs-form-990/201543169349300314_public.xml
VERMONT COMMUNITY FOUNDATION,https://s3.amazonaws.com/irs-form-990/201543169349302799_public.xml
VERMONTERS FOR CLEAN ENVIRONMENT INC,https://s3.amazonaws.com/irs-form-990/201543169349302799_public.xml
UNIVERSITY OF VERMONT MEDICAL CENTER AUXILIARY,https://s3.amazonaws.com/irs-form-990/201543169349302799_public.xml
VERMONT STATE AMATEUR HOCKEY ASSOCIATION,https://s3.amazonaws.com/irs-form-990/201543169349302799_public.xml
VERMONT VILLAGE COMMUNITY DEVELOPMENT C,https://s3.amazonaws.com/irs-form-990/201543169349302799_public.xml
VERMONT FLIGHT ACADEMY INC,https://s3.amazonaws.com/irs-form-990/201543169349302799_public.xml
VERMONT SLAUSON HOUSING CORPORATION,https://s3.amazonaws.com/irs-form-990/201543169349302799_public.xml
VERMONT SLAUSON LDC INC,https://s3.amazonaws.com/irs-form-990/201543169349302799_public.xml
CENTRAL VERMONT INVESTMENT CORPORATION,https://s3.amazonaws.com/irs-form-990/201543169349302799_public.xml
JOINT VERMONT YANKEE DEVELOPMENT COMMITTEE TRUST,https://s3.amazonaws.com/irs-form-990/201540139349301559_public.xml
VERMONT SLAUSON ECONOMIC DEVELOPMENT CORPORATION,https://s3.amazonaws.com/irs-form-990/201540139349301039_public.xml
VERMONT THEATRE FESTIVAL INC,https://s3.amazonaws.com/irs-form-990/201530149349100113_public.xml
FROZEN FINS VERMONT PARROTHEADS IN PARADISE INC,https://s3.amazonaws.com/irs-form-990/201520229349300512_public.xml
JOINT VERMONT YANKEE DEVELOPMENT COMMITTEE TRUST,https://s3.amazonaws.com/irs-form-990/201510219349200201_public.xml
VERMONT RETAIL LUMBER DEALERS ASSOCIATION INC CO NORTHEASTERN RETAIL LUMBER,https://s3.amazonaws.com/irs-form-990/201500209349200105_public.xml
PROFESSIONAL FIREFIGHTERS OF VERMONT,https://s3.amazonaws.com/irs-form-990/201500209349300815_public.xml
VERMONT FOSTERADOPTIVE FAMILY ASSO,https://s3.amazonaws.com/irs-form-990/201510209349301001_public.xml
CENTRAL VERMONT COUNCIL ON AGING INC,https://s3.amazonaws.com/irs-form-990/201510299349300146_public.xml
VERMONT YOUTH SOCCER ASSOCIATION,https://s3.amazonaws.com/irs-form-990/201540279349300544_public.xml
VERMONT CARDIAC NETWORK INC,https://s3.amazonaws.com/irs-form-990/201530359349300723_public.xml
VERMONT FAMILY FORESTS FOUNDATION,https://s3.amazonaws.com/irs-form-990/201540349349300029_public.xml
VERMONT ETV INC DBA VERMONT PBS,https://s3.amazonaws.com/irs-form-990/201500369349300815_public.xml
VERMONT CENTER FOR RURAL WOMEN INC,https://s3.amazonaws.com/irs-form-990/201530359349100703_public.xml
VERMONT ASSOCIATION OF HOSPITALS AND HEALTH SYSTEMS - NETWORK SERVICE ORG,https://s3.amazonaws.com/irs-form-990/201500369349300405_public.xml
VERMONT FOODBANK,https://s3.amazonaws.com/irs-form-990/201510349349301021_public.xml
NCR OF RUTLAND VERMONT,https://s3.amazonaws.com/irs-form-990/201500349349301000_public.xml
VERMONT OLD CEMETERY ASSOCIATION,https://s3.amazonaws.com/irs-form-990/201520349349200402_public.xml
VERMONT OLD CEMETERY ASSOCIATION,https://s3.amazonaws.com/irs-form-990/201520349349200402_public.xml
VERMONT OLD CEMETERY ASSOCIATION,https://s3.amazonaws.com/irs-form-990/201520349349200402_public.xml
VERMONT OLD CEMETERY ASSOCIATION,https://s3.amazonaws.com/irs-form-990/201520349349200402_public.xml
VERMONT OLD CEMETERY ASSOCIATION,https://s3.amazonaws.com/irs-form-990/201520349349200402_public.xml
VERMONT OLD CEMETERY ASSOCIATION,https://s3.amazonaws.com/irs-form-990/201520349349200402_public.xml
VERMONT OLD CEMETERY ASSOCIATION,https://s3.amazonaws.com/irs-form-990/201500429349200235_public.xml
VERMONT LEARNING COLLABORATIVE INC,https://s3.amazonaws.com/irs-form-990/201530409349200133_public.xml
SHRM VERMONT STATE COUNCIL INC,https://s3.amazonaws.com/irs-form-990/201520429349200327_public.xml
FAMILIES FIRST IN SOUTHERN VERMONT INC,https://s3.amazonaws.com/irs-form-990/201500439349301220_public.xml
VERMONT PROGRAM FOR QUALITY IN HEALTH CARE INC,https://s3.amazonaws.com/irs-form-990/201530439349301013_public.xml
VERMONT YOUTH BALLET INC,https://s3.amazonaws.com/irs-form-990/201500399349200350_public.xml
NATIONAL ASSOCIATION OF SOCIAL WORKERS VERMONT CHAPTER,https://s3.amazonaws.com/irs-form-990/201510429349301046_public.xml
YOUNG TRADITION VERMONT INC,https://s3.amazonaws.com/irs-form-990/201500409349200205_public.xml
SOUTHERN VERMONT BASEBALL UMPIRES ASSOCIATION INC,https://s3.amazonaws.com/irs-form-990/201540389349200409_public.xml
VERMONT YOUTH ORCHESTRA ASSOCIATION INC,https://s3.amazonaws.com/irs-form-990/201500439349200125_public.xml
VERMONT SUZUKI VIOLINS INC,https://s3.amazonaws.com/irs-form-990/201500419349200605_public.xml
STARBASE VERMONT INCORPORATED,https://s3.amazonaws.com/irs-form-990/201510429349200021_public.xml
ROTARY CLUB OF ST ALBANS VERMONT INC,https://s3.amazonaws.com/irs-form-990/201530419349200723_public.xml
RIVERMONT COLLEGIATE,https://s3.amazonaws.com/irs-form-990/201530419349300528_public.xml
VERMONT STATE FACULTY FEDERATION AFT LOCAL 3180,https://s3.amazonaws.com/irs-form-990/201540439349301964_public.xml
VERMONT BUSINESS EDUCATION CORPORATION,https://s3.amazonaws.com/irs-form-990/201530419349300303_public.xml
VERMONT EMPLOYEE OWNERSHIP CENTER,https://s3.amazonaws.com/irs-form-990/201520479349301597_public.xml
VERMONT CHILD CARE INDUSTRY AND CAREERS COUNCIL INC,https://s3.amazonaws.com/irs-form-990/201530509349300733_public.xml
GAY AND LESBIAN FUND OF VERMONT INC,https://s3.amazonaws.com/irs-form-990/201540449349302349_public.xml
SIGMA PHI OF VERMONT EDUCATIONAL FOUNDATION INC,https://s3.amazonaws.com/irs-form-990/201520479349301822_public.xml
CENTRAL VERMONT HUMANE SOCIETY INC,https://s3.amazonaws.com/irs-form-990/201530479349302103_public.xml
VERMONT CHIROPRACTIC ASSOCIATION INC,https://s3.amazonaws.com/irs-form-990/201530479349302103_public.xml
VERMONT STATE KNIGHTS OF COLUMBUS,https://s3.amazonaws.com/irs-form-990/201510449349200796_public.xml
VERMONT CHAPTER CONSTRUCTION SPECIFICATIONS INSTITUTE INC,https://s3.amazonaws.com/irs-form-990/201500449349200720_public.xml
VERMONT MORGAN HORSE ASSOCIATION IN,https://s3.amazonaws.com/irs-form-990/201510459349200011_public.xml
VERMONT PLUMBERS AND PIPEFITTERS LABOR MANAGEMENT FUND,https://s3.amazonaws.com/irs-form-990/201520479349301772_public.xml
GOOD BEGINNINGS OF CENTRAL VERMONT,https://s3.amazonaws.com/irs-form-990/201500449349300915_public.xml
VERMONT POLICE ASSOCIATION,https://s3.amazonaws.com/irs-form-990/201510449349200106_public.xml
VERMONT ASSOCIATION FOR MENTAL HEALTH AND ADDICTION RECOVERY INC,https://s3.amazonaws.com/irs-form-990/201530479349301848_public.xml
VERMONT COUNCIL ON WORLD AFFAIRS INC,https://s3.amazonaws.com/irs-form-990/201540449349302804_public.xml
CENTRAL VERMONT HIGH SCHOOL INITIATIVE,https://s3.amazonaws.com/irs-form-990/201520479349302062_public.xml
CAMPAIGN FOR VERMONT PROSPERITY INC,https://s3.amazonaws.com/irs-form-990/201510479349301696_public.xml
VERMONT HEALTH FOUNDATION INC,https://s3.amazonaws.com/irs-form-990/201540449349300804_public.xml
VERMONT PUBLIC LIBRARY FOUNDATION INC,https://s3.amazonaws.com/irs-form-990/201500489349200040_public.xml
VERMONT ASSOCIATION OF HOSPITALS AND HEALTH SYSTEMS INC,https://s3.amazonaws.com/irs-form-990/201530489349301103_public.xml
UNITED WAYS OF VERMONT INC,https://s3.amazonaws.com/irs-form-990/201500479349301510_public.xml
GUARDIANSHIP TRUST OF VERMONT INC,https://s3.amazonaws.com/irs-form-990/201520509349300732_public.xml
VERMONT NURSES IN PARTNERSHIP INC,https://s3.amazonaws.com/irs-form-990/201520479349200307_public.xml
ISRAEL CENTER OF VERMONT,https://s3.amazonaws.com/irs-form-990/201510489349300021_public.xml
RIVERMONT VOLUNTEER FIRE DEPT INC,https://s3.amazonaws.com/irs-form-990/201520579349300307_public.xml
VERMONT ACTORS REPERTORY THEATRE COMPANY,https://s3.amazonaws.com/irs-form-990/201520449349200437_public.xml
EARTHWALK VERMONT INC,https://s3.amazonaws.com/irs-form-990/201540579349300704_public.xml
VERMONT COALITION OF CLINICS FOR THE UNINSURED,https://s3.amazonaws.com/irs-form-990/201540549349300404_public.xml
VERMONT PI BETA PHI INC,https://s3.amazonaws.com/irs-form-990/201540479349200904_public.xml
TRI-STATE CHAPTER 843 VERMONT,https://s3.amazonaws.com/irs-form-990/201540719349200609_public.xml
VERMONT FUNERAL DIRECTORS AND EMBALMERS ASSOCIATION,https://s3.amazonaws.com/irs-form-990/201500719349200005_public.xml
MAKE A WISH FDN OF VERMONT,https://s3.amazonaws.com/irs-form-990/201530699349200508_public.xml
VERMONT CHEESE COUNCIL INC,https://s3.amazonaws.com/irs-form-990/201510719349200301_public.xml
VERMONT CHEESE COUNCIL INC,https://s3.amazonaws.com/irs-form-990/201540719349200304_public.xml
COUNCIL ON AGING FOR SOUTHEASTERN VERMONT INC,https://s3.amazonaws.com/irs-form-990/201530709349300833_public.xml
VERMONT DENTAL CARE PROGRAMS INC,https://s3.amazonaws.com/irs-form-990/201540779349300619_public.xml
ASSOCIATED INDUSTRIES OF VERMONT INC,https://s3.amazonaws.com/irs-form-990/201530759349300528_public.xml
BEVERAGE ASSOCIATION OF VERMONT,https://s3.amazonaws.com/irs-form-990/201520759349100317_public.xml
VERMONT VALLEY TAE KWON DO INC,https://s3.amazonaws.com/irs-form-990/201520759349100317_public.xml
VERMONT NORTH BY HAND ARTISAND COOPERATIVE,https://s3.amazonaws.com/irs-form-990/201520759349100317_public.xml
VERMONT-NEA,https://s3.amazonaws.com/irs-form-990/201520759349100317_public.xml
INCORPORATE ALUMNI OF VERMONT ALPHA OF PHI DELTA THETA,https://s3.amazonaws.com/irs-form-990/201520759349100317_public.xml
VERMONT AYRSHIRE CLUB,https://s3.amazonaws.com/irs-form-990/201520759349100317_public.xml
VERMONT GREEN BUILDING NETWORK,https://s3.amazonaws.com/irs-form-990/201540839349300859_public.xml
NORTHWESTERN VERMONT VIETMAN VETERANS OF AMERICA,https://s3.amazonaws.com/irs-form-990/201540839349300859_public.xml
VERMONT STAGE COMPANY,https://s3.amazonaws.com/irs-form-990/201520849349300817_public.xml
CAMP AGAPE VERMONT INC,https://s3.amazonaws.com/irs-form-990/201540909349300604_public.xml
VERMONT PHILHARMONIC INC,https://s3.amazonaws.com/irs-form-990/201510969349200206_public.xml
VERMONT JAZZ CENTER INC,https://s3.amazonaws.com/irs-form-990/201520809349300602_public.xml
VERMONT GOVERNORS COUNCIL ON PHYSICAL FITNESS,https://s3.amazonaws.com/irs-form-990/201540859349200014_public.xml
VERMONT GOLF COURSE SUPERINTENDENTS ASSOCIATION INC,https://s3.amazonaws.com/irs-form-990/201540829349200109_public.xml
VERMONT PARENT CHILD CENTER NETWORK INC,https://s3.amazonaws.com/irs-form-990/201541119349200204_public.xml
VERMONT DENTAL FOUNDATION,https://s3.amazonaws.com/irs-form-990/201511129349300731_public.xml
VERMONT CAMPAIGN FOR HEALTH CARE,https://s3.amazonaws.com/irs-form-990/201501139349200200_public.xml
VERMONT LEGAL AID INC,https://s3.amazonaws.com/irs-form-990/201531039349300603_public.xml
VERMONT STATE GRANGE PATRONS OF 487 BATTENKILL,https://s3.amazonaws.com/irs-form-990/201541059349300504_public.xml
VERMONT TRAVEL INDUSTRY CONFERENCE,https://s3.amazonaws.com/irs-form-990/201541059349300504_public.xml
VERMONT ASTRONOMICAL SOCIETY,https://s3.amazonaws.com/irs-form-990/201541059349300504_public.xml
VERMONT PWA COALITION,https://s3.amazonaws.com/irs-form-990/201541359349304819_public.xml
VERMONT OUTDOOR GUIDES ASSOCIATION,https://s3.amazonaws.com/irs-form-990/201541359349304819_public.xml
ASSOCIATION OF NOTRE DAME CLUBS INC VERMONT,https://s3.amazonaws.com/irs-form-990/201541359349304819_public.xml
VERMONT CLUB CHARITIES INC,https://s3.amazonaws.com/irs-form-990/201541359349304819_public.xml
CATHOLIC FOUNDATION TRUST OF VERMONT,https://s3.amazonaws.com/irs-form-990/201541359349304819_public.xml
VERMONT CRAFTS COUNCIL,https://s3.amazonaws.com/irs-form-990/201541359349304819_public.xml
VERMONT ELECTRIC COOPERATIVE INC,https://s3.amazonaws.com/irs-form-990/201541359349304819_public.xml
VERMONT KIN AS PARENTS INC,https://s3.amazonaws.com/irs-form-990/201541359349304819_public.xml
PATIENT CHOICES AT END OF LIFE VERMONT INC,https://s3.amazonaws.com/irs-form-990/201541359349304819_public.xml
VERMONT STATE WOMENS GOLF ASSOCIATION,https://s3.amazonaws.com/irs-form-990/201541359349304819_public.xml
VERMONT WOOD MANUFACTURERS ASSOCIATION,https://s3.amazonaws.com/irs-form-990/201541359349304819_public.xml
VERMONT LEADS INC,https://s3.amazonaws.com/irs-form-990/201541359349304819_public.xml
VERMONT STATE FIREFIGHTERS ASSOCIATION,https://s3.amazonaws.com/irs-form-990/201541359349304819_public.xml
VERMONT ACTIVE CHAPTER OF SIGMA PHI SOCIETY,https://s3.amazonaws.com/irs-form-990/201541359349304819_public.xml
ALPHA CHAPTER OF THE OF SIGMA PHI SOCIETY OF THE UNIVERSITY OF VERMONT,https://s3.amazonaws.com/irs-form-990/201541359349304819_public.xml
VERMONT SOCIETY OF LAND SURVEYORS INC,https://s3.amazonaws.com/irs-form-990/201541359349304819_public.xml
VERMONT INSTITUTE OF CONTEMPORARY ARTS,https://s3.amazonaws.com/irs-form-990/201540799349300004_public.xml
VERMONT REFUGEE ASSISTANCE INC,https://s3.amazonaws.com/irs-form-990/201500909349300615_public.xml
VERMONT PSYCHOLOGICAL ASSOCIATION INC,https://s3.amazonaws.com/irs-form-990/201530929349300538_public.xml
VERMONT HIGHER EDUCATION COUN,https://s3.amazonaws.com/irs-form-990/201540909349300204_public.xml
VERMONT ASSOCIATION OF CONSERVATION DISTRICTS INC,https://s3.amazonaws.com/irs-form-990/201500829349200200_public.xml
ENERGIZE VERMONT INC,https://s3.amazonaws.com/irs-form-990/201510909349200506_public.xml
PRIDE CENTER OF VERMONT INC,https://s3.amazonaws.com/irs-form-990/201530849349200603_public.xml
RIVERMONT YOUTH ATHLETIC ASSOCIATION IN,https://s3.amazonaws.com/irs-form-990/201510869349200621_public.xml
ENERGIZE VERMONT FOUNDATION INC,https://s3.amazonaws.com/irs-form-990/201530919349300423_public.xml
VERMONT LIONS CHARITIES INC,https://s3.amazonaws.com/irs-form-990/201530929349200728_public.xml
VOICES OF VERMONTERS PUBLISHING GROUP INC,https://s3.amazonaws.com/irs-form-990/201530879349200108_public.xml
VERMONT CHRISTIAN EDUCATION FOUNDATION LTD,https://s3.amazonaws.com/irs-form-990/201530879349200108_public.xml
VERMONT HEALTH SERVICES GROUP,https://s3.amazonaws.com/irs-form-990/201530879349200108_public.xml
NORTHERN VERMONT RESOURCE CONSERVATION AND DEV COUNCIL,https://s3.amazonaws.com/irs-form-990/201530879349200108_public.xml
VERMONT AVENUE BAPTIST CHURCH DEVELOPMENT CORPORATION,https://s3.amazonaws.com/irs-form-990/201530879349200108_public.xml
BUILDING PERFORMANCE PROFESSIONALS ASSOCIATION OF VERMONT,https://s3.amazonaws.com/irs-form-990/201520829349100607_public.xml
VERMONT COMPANION ANIMAL NEUTERING INC,https://s3.amazonaws.com/irs-form-990/201501279349301150_public.xml
VERMONT INTERFAITH ACTION INC,https://s3.amazonaws.com/irs-form-990/201511209349200216_public.xml
VERMONT EASTERN STAR HOME INC,https://s3.amazonaws.com/irs-form-990/201531179349200428_public.xml
VERMONT INFORMATION TECHNOLOGY LEAD,https://s3.amazonaws.com/irs-form-990/201501249349300600_public.xml
VERMONT AFRICAN AMERICAN HISTORY PROJECT INC,https://s3.amazonaws.com/irs-form-990/201531209349100928_public.xml
VERMONT SOCIETY OF HEALTH SYSTEM PHARMACISTS INC,https://s3.amazonaws.com/irs-form-990/201511269349200406_public.xml
VERMONT CENTER FOR GEOGRAPHIC INFORMATION INC,https://s3.amazonaws.com/irs-form-990/201521259349301702_public.xml
ASSOCIATED GENERAL CONTRACTORS OF VERMONT INC,https://s3.amazonaws.com/irs-form-990/201520489349300802_public.xml
VERMONT BUSINESS ROUNDTABLE INC,https://s3.amazonaws.com/irs-form-990/201501259349300245_public.xml
VERMONT MAPLE SUGAR MAKERS ASSOC INC,https://s3.amazonaws.com/irs-form-990/201541609349300404_public.xml
UNIVERSITY OF VERMONT AND STATE ARG COLLE,https://s3.amazonaws.com/irs-form-990/201511179349100706_public.xml
VERMONT NETWORK AGAINST DOMESTIC AND SEXUAL VIOLENCE INC,https://s3.amazonaws.com/irs-form-990/201531629349300103_public.xml
VERMONT ACHIEVEMENT CENTER,https://s3.amazonaws.com/irs-form-990/201531629349300338_public.xml
VERMONT ELKS CHARITIES INC,https://s3.amazonaws.com/irs-form-990/201521699349200622_public.xml
ASSOCIATION OF VERMONT CREDIT UNIONS INC,https://s3.amazonaws.com/irs-form-990/201541289349302079_public.xml
VERMONT RIVER CONSERVANCY INC,https://s3.amazonaws.com/irs-form-990/201511639349300041_public.xml
CENTRAL VERMONT SUBSANCO ABUSE SERVICES INC,https://s3.amazonaws.com/irs-form-990/201501349349304425_public.xml
VOICES FOR VERMONTS CHILDREN,https://s3.amazonaws.com/irs-form-990/201501329349301300_public.xml
HILLEL AT THE UNIVERSITY OF VERMONT,https://s3.amazonaws.com/irs-form-990/201511339349303501_public.xml
VERMONT CLUB ACTIVITIES INC,https://s3.amazonaws.com/irs-form-990/201501349349203200_public.xml
VERMONT HOUSING FINANCE AGENCY,https://s3.amazonaws.com/irs-form-990/201501349349306320_public.xml
OUR HOUSE OF CENTRAL VERMONT INC,https://s3.amazonaws.com/irs-form-990/201501349349302325_public.xml
VERMONT SUSTAINABLE JOBS FUND INC,https://s3.amazonaws.com/irs-form-990/201521339349301552_public.xml
CENTRAL VERMONT COMMUNITY TELEVISION,https://s3.amazonaws.com/irs-form-990/201530719349300618_public.xml
VERMONT FARM BUREAU INC,https://s3.amazonaws.com/irs-form-990/201511339349303621_public.xml
VERMONT FEDERATION OF FAMILIES FOR CHILDRENS MENTAL HEALTH INC,https://s3.amazonaws.com/irs-form-990/201521349349303442_public.xml
VERMONT RURAL WATER ASSOCIATION,https://s3.amazonaws.com/irs-form-990/201501329349301370_public.xml
VERMONT MORTGAGE BANKERS ASSOCIATION,https://s3.amazonaws.com/irs-form-990/201540689349200519_public.xml
VERMONT BEEF INDUSTRY COUNCIL INC,https://s3.amazonaws.com/irs-form-990/201531339349202658_public.xml
VERMONT ASSOC OF NURSE ANESTHETISTS,https://s3.amazonaws.com/irs-form-990/201531319349200808_public.xml
GOVERNORS INSTITUTES OF VERMONT,https://s3.amazonaws.com/irs-form-990/201541889349300114_public.xml
VERMONT MOUNTAIN BIKE ADVOCATES,https://s3.amazonaws.com/irs-form-990/201511869349300001_public.xml
VERMONT COVERTSWOODLANDS FOR WILDLIFE INC,https://s3.amazonaws.com/irs-form-990/201501849349200700_public.xml
CORPORATION OF SOUTHERN VERMONT COLLEGE INC,https://s3.amazonaws.com/irs-form-990/201541349349300004_public.xml
BIRDS OF VERMONT MUSEUM INC,https://s3.amazonaws.com/irs-form-990/201501339349303605_public.xml
VERMONT AUTOMOBILE DEALERS ASSOCIA INC,https://s3.amazonaws.com/irs-form-990/201541349349305679_public.xml
